username;date;retweets;favorites;text;geo;mentions;hashtags;id;permalink
;2018-08-31 15:33;0;1;"Random facts about me as I procrastinate: 1) as mentioned, I am the left-handed firstborn of a seventh daughter 2) Aquarius, Scorpio Moon, Gemini rising. #sorrynotsorry 3) I’m a master number 11 in numerology 4) I’m an ENTP 5) I’m a Metal Monkey in the Chinese zodiac";;;#sorrynotsorry;"1035656742938521606";https://twitter.com/rose_sinister/status/1035656742938521606
;2018-08-31 04:43;0;0;"I am having a sweet and dazzling dream that a winsome audacious auburn ENTP goddess, insistently caressing an indigo white baseball cap, and is knowingly walking with a chestnut Gypsy Vanner horse.";;;;"1035493360755200000";https://twitter.com/MBTIhorsewomen/status/1035493360755200000
;2018-08-30 09:30;0;0;"Hi, I am an #entp with tertiary Fe. Please, be careful when loving us. We arent exactly the best people to love. But thank you for the compliment";;;#entp;"1035203235894763523";https://twitter.com/LoreAdept/status/1035203235894763523
;2018-08-29 20:45;1;3;"Muhahahahahahaha!!!!!!! I am definitely an ENTP ! The definition of a visionary on all the personality tests I’ve taken.";;;;"1035010560641753088";https://twitter.com/VirtSecurity/status/1035010560641753088
;2018-08-29 10:32;1;2;"Person: do you have time to join our cause? #Entp , an intellectual: but my schedule is packed. I am too busy: breathing, eating, and avoiding my other responsibilities.";;;#Entp;"1034856363904655360";https://twitter.com/LoreAdept/status/1034856363904655360
;2018-08-27 23:29;0;0;"Again, as an ENTP , I am a very idea based person. Most of what I say is an idea. It is not a plan and don’t have an emotional reaction to it.";;;;"1034326971679879169";https://twitter.com/emireeville/status/1034326971679879169
;2018-08-26 16:13;0;0;"I am having a sweet and amazing dream that an ambidextrous ENTP jet setter, exquisitely drying her eyes with the edge of an aquamarine halter top, gingerly galloping along a innovative beach at sunset on a friendly and calm Shire horse.";;;;"1033855031852900352";https://twitter.com/MBTIhorsewomen/status/1033855031852900352
;2018-08-25 16:14;0;0;"aye! a fellow intuitive person like i am ! some part of me feels like I should have been an ENTP or ENFP but I only think I got the J bc I like to plan and organize";;;;"1033492835285315585";https://twitter.com/blacyardigans/status/1033492835285315585
;2018-08-25 15:08;0;1;"well I *am * an entp";;;;"1033476213854097408";https://twitter.com/kirishms/status/1033476213854097408
;2018-08-25 12:32;0;1;"I am a proud ISTJ personally, and I love running the MB tests on my characters. I found out my main was an ENTP and that drove me crazy personally trying to make sure that I stayed true to them. But, it was worth it to do the research!";;;;"1033437085661835264";https://twitter.com/mrs_y_writer/status/1033437085661835264
;2018-08-23 17:21;1;2;"Below was my comment on a Yahoo article on Yahoo that failed to mention that the Mollie Tibbetts killer was an Illegal Alien. It was two days ago when the news just broke... Not the reply's and thumbs up/down... Think I am not be censored by Yahoo??? Obvious isn't it. pic.twitter.com/t9Rqb7pWYH";;;;"1032784807837790209";https://twitter.com/ENTP_MBA/status/1032784807837790209
;2018-08-23 13:11;0;1;"I am usually ENTP with an occasional ENTJ.";;;;"1032722101281742848";https://twitter.com/agingernole/status/1032722101281742848
;2018-08-21 18:25;0;1;"I am an #ENTP -A (borderline #ENFP - Assertive). What is your type? https://www. 16personalities.com/free-personali ty-test … #16Personalities #ENFJ ? #ENFP ? @16Personalities #myersbriggs ?";;@16Personalities;#ENTP #ENFP #16Personalities #ENFJ #ENFP #myersbriggs;"1032076226100441090";https://twitter.com/Clermont1/status/1032076226100441090
;2018-08-21 17:04;0;1;"I have a twenty five year old daughter that I love with heart and soul... If she were to be killed by an illegal I believe that the last person the illegal saw alive would be me. Sorry but I am a father.";;;;"1032055845830447105";https://twitter.com/ENTP_MBA/status/1032055845830447105
;2018-08-21 12:09;0;0;"I thought I was an ENTJ for a long time, but it turns out that I am an ENTP . How have I managed?";;;;"1031981544330735616";https://twitter.com/johnhaydenmpls/status/1031981544330735616
;2018-08-20 00:09;0;1;"i am an ENTP !!";;;;"1031438165402443777";https://twitter.com/phitsosting/status/1031438165402443777
;2018-08-16 08:43;0;5;"Interesting conversation with firstborn just now about how he thinks I consider options too much and that people who get things done just ACT. He cited great generals and such. And he's not exactly wrong... But I am not a general. I am a, however, an ENTP - and one of our";;;;"1030117902043803649";https://twitter.com/theNthJennifer/status/1030117902043803649
;2018-08-15 17:43;0;0;"I am having a sweet and skillful dream that an insightful and wonderful ENTP princess, flipping her long and silky tresses over an Indian print chemise, gradually fords a quietly burbling stream mounted on a nervously quivering Danube Delta horse.";;;;"1029891401755107328";https://twitter.com/MBTIhorsewomen/status/1029891401755107328
;2018-08-15 17:00;0;0;"On the MBTI I am an ENTP https://www. youtube.com/watch?v=tW3moM nzCJg&index=82&list=PLQTiOe1TR5plQ4ifaVpu1Y4XJhYmwYqaM …";;;;"1029880442768580609";https://twitter.com/nsfm_ohmy/status/1029880442768580609
;2018-08-14 13:44;0;0;"The sign an ENTP , like I am , is interested in your thought process is debating with you. It's not that we don't respect you. It's that we respect you so much, we allow you to see our own thought process to the... https://www. facebook.com/chrisditt/post s/10155758370178603 …";;;;"1029468735742963714";https://twitter.com/chrisdittemore/status/1029468735742963714
;2018-08-08 22:10;0;3;"It’s an even split. I never know which to listen to. Guess that’s why I am tied ENTP and ENFP";;;;"1027421815084265472";https://twitter.com/BlueGoesMew/status/1027421815084265472
;2018-08-05 11:08;0;0;"Just took this typology test again and i am an ENTP";;;;"1026167991149506562";https://twitter.com/oXBruceWayneXo/status/1026167991149506562
;2018-08-04 10:01;0;2;"(btw, if you're into that whole Meyers Briggs stuff I usually come out ENTP , which I am told means I'm always up for a good argument and will sometimes take up an opposite position just for the love of the sport.)";;;;"1025788889670152192";https://twitter.com/shebainpdx/status/1025788889670152192
;2018-08-04 06:01;0;0;"Soooo... which of your Shiver or Raven Cycle characters is an ENFP? I am curious to see which one is me and if I connected with him/her while reading the books. Also, my hubby is an ENTP .";;;;"1025728458905866241";https://twitter.com/leRevasseur/status/1025728458905866241
;2018-07-31 19:38;0;0;"I am an ENTP ! I think!";;;;"1024484544517496833";https://twitter.com/worstwordy/status/1024484544517496833
;2018-07-31 08:54;0;0;"I am an entp in the mbti personality classification and my ultimate idol is zico who's also an entp . Youngk is also an entp and I have very bad feelings about him";;;;"1024322328677629952";https://twitter.com/_callmesan/status/1024322328677629952
;2018-07-30 08:29;2;21;"“I’m an ENTP ” “I’m an ENFJ” “ I am depressed”";;;;"1023953784643510273";https://twitter.com/niklaus928/status/1023953784643510273
;2018-07-26 14:42;0;0;"Looks like I am still an ENTP ! I'm not sure if I should feel bad that I haven't changed at all in the last two years, or if I should feel bad that I'm trying to justify my personality using an online test. pic.twitter.com/a3v9XmVM5h";;;;"1022597954312392711";https://twitter.com/instigare/status/1022597954312392711
;2018-07-16 11:12;0;0;"Again, i am an ENTP . https://www. youtube.com/watch?v=s_-4yb KPxjE&t=684s …";;;;"1018921430338146304";https://twitter.com/knrasm/status/1018921430338146304
;2018-07-16 03:55;0;1;"deadpool is an estp/ entp and i am an intj, pero why do i relate to him so much???? why am i a literal asshole with zero social skills but he is actually my inner thoughts? america explain";;;;"1018811300946690048";https://twitter.com/sickdaddy666/status/1018811300946690048
;2018-07-12 02:43;0;0;"Nah, I disagree. I think he’s certainly an NT type but either INTP or INTJ. (I would love for him to be an ENTP though, since I am one)";;;;"1017343675247091712";https://twitter.com/DetectiveDrake/status/1017343675247091712
;2018-07-11 15:29;0;1;"Its weird cause whether or not i’m an infp or an entp depends on how depressed i am LOL";;;;"1017173971580534784";https://twitter.com/storrntrooper/status/1017173971580534784
;2018-07-10 06:54;0;0;"ENTP Capricorn. I am not an ESTJ.";;;;"1016682081152327680";https://twitter.com/Antidiocy/status/1016682081152327680
;2018-07-09 09:36;0;1;"I get along really well with 8s. My dad was an 8 core, and avoiding conflict pisses me off, and 8 fixes tend to just say it more. Somehow I am marrying an ENTP 9 though.. LOL-- off, but on topic I noticed we are both cancer ascendant!";;;;"1016360335387787267";https://twitter.com/katPassionate/status/1016360335387787267
;2018-07-06 10:19;0;0;"I am an ENTP Fight me";;;;"1015284133352886273";https://twitter.com/Otisandmilo/status/1015284133352886273
;2018-07-04 21:13;0;0;"I also love Gone With the Wind so much because Scarlett O'Hara is the ultimate definition of a good Slytherin. Rhett Butler in my opinion is also a Slytherin, but can educatedly be argued as a Gryffindor. However he is definitely an ENTP personality, which I am .";;;;"1014723820198998016";https://twitter.com/Jeremy_Armada/status/1014723820198998016
;2018-07-04 06:12;3;16;"Which Personality are you? I was asked recently (very) and I am between an ENTP and ENTF. pic.twitter.com/aYyqIxj7eC";;;;"1014497059930542081";https://twitter.com/RicMTheGM/status/1014497059930542081
;2018-07-01 12:56;0;0;"Nice! I just did this at work as well. I am an ENTP";;;;"1013511777093423104";https://twitter.com/erogroth/status/1013511777093423104
;2018-06-29 21:25;0;0;"I am an ENTP gemini";;;;"1012915014926262273";https://twitter.com/mintbenji/status/1012915014926262273
;2018-06-27 06:29;0;0;"try the myers-briggs ellie https://www. 16personalities.com / fyi I am an ENTP and the greatest PM of all time Maragaret Thatcher was an ENTJ";;;;"1011964771275558912";https://twitter.com/IdreeceKhan/status/1011964771275558912
;2018-06-24 03:52;0;0;"I like INFJs, they have a lot of empathy and usually have big hearts. I already can see that from your tweets. I am an ENTP";;;;"1010837947007033344";https://twitter.com/rodolfo_rosario/status/1010837947007033344
;2018-06-24 01:42;0;0;"Why the fuck am I previously listed as an ISFP I am a full time ENTP";;;;"1010805254567292929";https://twitter.com/JuliusSurya_/status/1010805254567292929
;2018-06-21 08:26;0;0;"Apparently, I am an ENTP . (Still reading the summary to decide how much I agree with this).";;;;"1009819803731873792";https://twitter.com/esthergbenz/status/1009819803731873792
;2018-06-21 01:52;0;0;"as an entp i constantly feel like i have to repress who i am because a part of me wants to argue, be factual and honest but another part of me doesn't want to deal with the consequences (aka hurting other people's feelings) so i do both and people call me moody lol";;;;"1009720766118727680";https://twitter.com/mbticrap/status/1009720766118727680
;2018-06-19 14:48;0;0;"I have said many times that I am an ENTP personality type. The Debater. I have also preached the gospel of #BALANCE #GRAY Now I have been leaning awfully hard on @Disney and the clowns of Lucasfilm, so last night I thought how do I REALLY KNOW if I have thrown my lot in with good";;@Disney;#BALANCE #GRAY;"1009191094402371586";https://twitter.com/ShayneBIGCAT/status/1009191094402371586
;2018-06-19 08:30;0;1;"LOL. I'm very sure I am an ENFJ - and unfortunately, I am marrying another ENTP :(";;;;"1009096059417694209";https://twitter.com/katPassionate/status/1009096059417694209
;2018-06-15 09:17;0;1;"I love challenges. I am an ENTP";;;;"1007658357816250368";https://twitter.com/DRALEXANP/status/1007658357816250368
;2018-06-13 09:26;0;0;"I am an ENTP";;;;"1006935846421868545";https://twitter.com/aigirlfriend/status/1006935846421868545
;2018-06-09 11:29;0;1;"I am an ENxP. My F and T are tied, but my husband is INFP, so I function more ENTP .";;;;"1005517375330873344";https://twitter.com/coraliecowan/status/1005517375330873344
;2018-06-09 07:15;0;5;"I picked ENTP , because that is probably the type that I can most easily converse with when first meeting them. However, I do not have any long term friendships with ENTPs. The people that I am closest to IRL are an INFP, an INTJ, and another INFJ.";;;;"1005453290765717504";https://twitter.com/MsWired/status/1005453290765717504
;2018-06-08 16:11;0;1;"tau yang 16personalities itu ga? kamu tipe orang apa? — i am an entp http:// lap87.ask.fm/igoto/45DKECN7 5V62DDAUPY6IQO7N72CDJPY3QPYOBCP7D7SLNZN62UYY2Z2LEZE4WRBXKS2PWHYCJQUH4DB7YEV7M2VONS5LPBQLUIORJE2YHVWSCKGPBOHXYPXKSC27R6LPZSTI2HQ7ZPMHHFUBJSVUMHK723PXP7FJ23IU563BT6PPYPY= …";;;;"1005225806480728064";https://twitter.com/iyaiyainaja/status/1005225806480728064
;2018-06-07 04:54;0;0;"21. My previous acc was ENTPdragon, bc I love dragons and I am an ENTP ; when I was locked out of that account I went back to this, very old account and changed it to ENTPvillain, bc I love villains and I am an ENTP 22. Slytherin!!";;;;"1004692984355606529";https://twitter.com/ENTPvillain/status/1004692984355606529
;2018-06-04 20:37;0;1;"i cannot accept my ESTP status I am an ENTP";;;;"1003843150694080512";https://twitter.com/witchsenpai/status/1003843150694080512
;2018-06-01 13:21;0;0;"As an ENTP , i could really place myself in the extreme ends of choices and everything, which makes it harder. . . . One side of me says yes i am studying and doing all these for my own happiness and goals One side says i am doing all these just to distract myself from jozy";;;;"1002646218172858368";https://twitter.com/pockyris/status/1002646218172858368
;2018-05-31 15:43;0;0;"I am having a sweet and original dream that an insightful and kind ENTP sorceress, sporting a Wedgwood blue beret, quietly brushes the remarkable mane of a visibly shaking Narragansett pacer.";;;;"1002319622379536384";https://twitter.com/MBTIhorsewomen/status/1002319622379536384
;2018-05-30 15:43;0;0;"I read this thing that intj x entp is the true meaning of opposites attract .. and i am an intj ..";;;;"1001957208475697152";https://twitter.com/exosf9/status/1001957208475697152
;2018-05-28 10:16;0;0;"people get so frustrated when they argue with me bc i always "win". fellas it's not worth it arguing with me, i am and will always be an entp debater, you're set to lose arguments from the start";;;;"1001150110573711360";https://twitter.com/mavencaIor/status/1001150110573711360
;2018-05-27 08:11;0;18;"good morning I am an ENTP and today found out my boyfriend is an ISFP pic.twitter.com/FoHB6yitAt";;;;"1000756465211232256";https://twitter.com/AlainaAppaloosa/status/1000756465211232256
;2018-05-25 12:24;0;2;"hello i am an infj sagittarius, looking for an entp leo";;;;"1000095395719012352";https://twitter.com/letttucehead/status/1000095395719012352
;2018-05-21 13:14;0;0;"I'd love to particiate in the "IQ Test" dragging today, but somehow @StefanMolyneux has already blocked me and I don't remember why. Anyhoo, I am an ENTP , a Leo with Libra rising, and I saw Bill Gates in person once at a wheatgrass bar in 1998.";;@StefanMolyneux;;"998658275070562304";https://twitter.com/droctopu5/status/998658275070562304
;2018-05-20 23:35;0;0;"I am an ENTP";;;;"998452305031659522";https://twitter.com/CSJosephLife/status/998452305031659522
;2018-05-19 03:05;0;0;"Pretty damn confused now about my myers Briggs personality type, jiirrr. Am i am an I/ENFP/ ENTP Every time i take the quiz i get a different answer @http://www. 16personalities.com Can someone please help me, i dont like being confused";;@http;;"997780264947519488";https://twitter.com/cadesia_debruin/status/997780264947519488
;2018-05-17 09:13;0;0;"I am having a sweet and wonderful dream that an exquisitely featured Scottish ENTP lass, philosophically drying her eyes with the edge of her lavender blue skirt, runs the tips of her fingers delicately along the spine of a nervously quivering Shetland pony.";;;;"997148003432574976";https://twitter.com/MBTIhorsewomen/status/997148003432574976
;2018-05-14 20:12;0;0;"I can’t stand type B personality people. I really can’t stand people who follow routines and try to force them on me or anyone else. I am a type A personality. On top of being an ENTP personality set and a Taurus on the cusp of Gemini with a Leo moon so I def hate conformity";;;;"996226853206679553";https://twitter.com/bornrazorsharp/status/996226853206679553
;2018-05-11 23:48;0;1;"Chen is an ENTP , and I'm an INFJ which are apparently perfectly matched types for each other, and I am just so happy knowing this";;;;"995193893867196416";https://twitter.com/lightningodin13/status/995193893867196416
;2018-05-10 15:55;0;0;".... I think you should just get into the fuctions instead of basic your one and only argument on an online test. The test said I was INTP, but I am an ENTP . Online tests are interesting, but those results should not be taken as a fact, just bc it is the result";;;;"994712495456751621";https://twitter.com/ENTPvillain/status/994712495456751621
;2018-05-08 04:28;0;0;"I just took a cognitive test, and found out my both Te Ti functing is developed more than Fi, which makes me an ENTP . But at another time, I took the test like 3 times in 3 months period and the result is ENFP with F/T average comparison 51/49. I guess, I am something in between";;;;"993814891407466496";https://twitter.com/ristarrahman/status/993814891407466496
;2018-05-07 21:53;0;0;"Teddy Roosevelt was an ENTP and are any of us surprised I am as well #NPS";;;#NPS;"993715538558930944";https://twitter.com/DrDre_a/status/993715538558930944
;2018-05-07 19:39;0;2;"I am SUCH an ENTP it’s wild";;;;"993681871769886721";https://twitter.com/jmashh_/status/993681871769886721
;2018-05-06 23:00;0;0;"On the MBTI I am an ENTP https://www. youtube.com/watch?v=tW3moM nzCJg&index=81&list=PLQTiOe1TR5plQ4ifaVpu1Y4XJhYmwYqaM …";;;;"993369856035745792";https://twitter.com/nsfm_ohmy/status/993369856035745792
;2018-05-06 21:06;0;0;"I am an ENTP , hell I made a video about it: https:// youtu.be/qC5i-4VbSx4";;;;"993341388216590336";https://twitter.com/CSJosephLife/status/993341388216590336
;2018-05-05 17:33;0;0;"When I took a personality test a few years ago I was an ENTP , now I am an ENFP what does this mean? by @HappyINFJ https://www. quora.com/When-I-took-a- personality-test-a-few-years-ago-I-was-an-ENTP-now-I-am-an-ENFP-what-does-this-mean/answer/Rachel-Green-92?share=e44b7c5b … #MBTI #wrong -type #ENTP #ENFP #gender -differences";;@HappyINFJ;#MBTI #wrong #ENTP #ENFP #gender;"992925358168072192";https://twitter.com/HappyINFJ/status/992925358168072192
;2018-05-04 09:37;0;0;"my Myers Briggs was a solid INFP for five years, last year I retook it several times and ended up with ENFP, but now they're telling me I'm an ENTP so idk who I am";;;;"992443052089335809";https://twitter.com/AGhostOfNothing/status/992443052089335809
;2018-05-03 15:55;0;1;"are you familiar with the cognitive functions? :) I am an ENTP";;;;"992175952431058948";https://twitter.com/LFC5times2015/status/992175952431058948
;2018-04-30 17:29;0;0;"I don't know how I'm an ENTP /ENFP when I am THIS judgmental.";;;;"991112406830108673";https://twitter.com/MariaFancyPants/status/991112406830108673
;2018-04-28 05:10;0;1;"In case you are wondering I am an ENTP , aka a VISIONARY. pic.twitter.com/y804phrlM6";;;;"990201489829265408";https://twitter.com/RoseBuck_/status/990201489829265408
;2018-04-26 13:42;0;0;"I am an ENTP .";;;;"989605539528163328";https://twitter.com/CSJosephLife/status/989605539528163328
;2018-04-26 06:08;1;4;"I am not an ENTP , but I can see why entps would think that.";;;;"989491368589447169";https://twitter.com/katavasis/status/989491368589447169
;2018-04-24 07:03;0;0;"I am an ENTP . What's Chaotic Good?";;;;"988780487828295682";https://twitter.com/sort_thyself/status/988780487828295682
;2018-04-23 11:00;0;0;"On the MBTI I am an ENTP https:// youtu.be/tW3moMnzCJg?li st=PLQTiOe1TR5plQ4ifaVpu1Y4XJhYmwYqaM …";;;;"988477628691697665";https://twitter.com/nsfm_ohmy/status/988477628691697665
;2018-04-21 14:13;0;0;"How Can I Tell if I am an INTJ or an ENTP ? http:// dlvr.it/QQKpJ1";;;;"987801556035682304";https://twitter.com/USDailyReview/status/987801556035682304
;2018-04-20 09:27;0;0;"I used to be an ENTP . Now I don't know who I am ! #sarcasm #psychology https:// twitter.com/AdamMGrant/sta tus/986255991548280832 …";;;#sarcasm #psychology;"987367150959628288";https://twitter.com/SharpeningSaw/status/987367150959628288
;2018-04-19 03:55;0;1;"I am capable of doing lots of things, And i could be capable in many more, But if only i really put my mind into it but I'm an ENTP so blame on my mbti";;;;"986921137966792704";https://twitter.com/WAT3MB1K4I/status/986921137966792704
;2018-04-19 00:46;0;2;"I am an ENTP";;;;"986873555492265984";https://twitter.com/Wowolfz/status/986873555492265984
;2018-04-18 21:57;0;0;"How do you know that he is? At first glance he is definitely that type. I am an ENTP . It is cool that you are an INFJ. It is the rarest type isn’t it?";;;;"986831054467022848";https://twitter.com/Chiaroscuro515/status/986831054467022848
;2018-04-18 03:01;0;0;"Father. My head is going to explode. Btw I am an ENTP . I just woke up and brain cells just starting... Are you surmising that if God speaks to you directly your only reaction must be sacramental and Your conversion is instantaneous?";;;;"986545145335214085";https://twitter.com/ITGeekCT/status/986545145335214085
;2018-04-17 08:18;0;1;"Glad you enjoyed it, I am an ENTP .";;;;"986262735166963712";https://twitter.com/CSJosephLife/status/986262735166963712
;2018-04-16 09:38;0;2;"How cool that you have all taken this MBTI test! I am an ENTP . Now of course I’m going to have to check out the book mentioned in this thread. So interesting!";;;;"985920368136327168";https://twitter.com/ITGeekCT/status/985920368136327168
;2018-04-13 22:52;0;0;"I am an ENTP , check this out: https:// youtu.be/Ghe48e4BSYI";;;;"985033027716722688";https://twitter.com/CSJosephLife/status/985033027716722688
;2018-04-12 16:09;0;0;"I am an ENTP .";;;;"984569179373121536";https://twitter.com/CSJosephLife/status/984569179373121536
;2018-04-12 10:37;1;1;"Of course I am . I'm an ENTP after all.";;;;"984485717953753088";https://twitter.com/NoFunOverlord/status/984485717953753088
;2018-04-11 18:59;0;2;"I am an ENTP ! Extravert, Intuitive, Thinker, Perceiver! What is your Jung personality type? Free test with premium option for extended report: https://www. 123test.com/jung-personali ty-test/ …";;;;"984249630589444099";https://twitter.com/JiminsBookmark/status/984249630589444099
;2018-04-06 01:03;0;1;"RT https:// twitter.com/Jalcroix/statu s/982155070966980608 … Week is coming to an end in Bratislava @EIHA_Official #ENTP Camp. I am so grateful for my Medical Team, bringing us through thick and thin #sportstherapist #strengthcoa … pic.twitter.com/i5ggcS6Kte RT https:// twitter.com/EIHA_Official/ status/982162674527031297 … RT … https://twitter.com/Jalcroix/status/982155070966980608/photo/1 pic.twitter.com/i5ggcS6Kte";;@EIHA_Official;#ENTP #sportstherapist #strengthcoa;"982166865114890241";https://twitter.com/john16oliver/status/982166865114890241
;2018-04-06 00:16;3;38;"Week is coming to an end in Bratislava @EIHA_Official #ENTP Camp. I am so grateful for my Medical Team, bringing us through thick and thin #sportstherapist #strengthcoach #aeconsultant #icehockey #medicalteam pic.twitter.com/Pqss5elkpz";;@EIHA_Official;#ENTP #sportstherapist #strengthcoach #aeconsultant #icehockey #medicalteam;"982155070966980608";https://twitter.com/Jalcroix/status/982155070966980608
;2018-04-05 08:15;0;0;"You will never win that argument with those who stand on the other side. The will pull the burger-flipper versus the cancer curer right out. Understand I am an ENTP and often argue from positions I may not actually agree with...in order to make my points. https:// twitter.com/SusanofTexas/s tatus/981912772899491841 …";;;;"981913105130295303";https://twitter.com/TGTarheel/status/981913105130295303
;2018-04-04 21:33;3;4;"Facts. And I am an extrovert. #ENTP pic.twitter.com/3UVY24vlKv";;;#ENTP;"981751578406334464";https://twitter.com/agenthawthorne/status/981751578406334464
;2018-04-03 13:07;0;0;"this is a mood... for a while i thought i was entp but alas i am just an intp with adhd, Ti rules every waking moment of my got damn life... i'm out here excusing my bullshit w/ "haha sorry guys that's just the Ti" and when people ask questions i type them, i'm in HELL";;;;"981261809431687168";https://twitter.com/bigbangstream/status/981261809431687168
;2018-03-30 22:15;0;0;"Ok. I am an Entp . We dont explain. Everything well and arguing is a natural skill for is that we have either groomed like a garden or just let decay into a spiral of arguementative entropy. I feel like a judged would be better at explaining technique and information.";;;;"979950340702384129";https://twitter.com/LoreAdept/status/979950340702384129
;2018-03-29 13:34;0;3;"after conversation with work colleagues today I decided to take the #MyersBriggs assessment. I am proudly an ENTP (let's hope I can remember this in case anyone ever ask)";;;#MyersBriggs;"979456899811807232";https://twitter.com/heydavebell/status/979456899811807232
