username;date;retweets;favorites;text;geo;mentions;hashtags;id;permalink
;2019-04-29 23:44;0;3;"so am i just an introverted entp or an extroverted intp i am confusion";;;;"1123115854051196928";https://twitter.com/PapemelroticPAT/status/1123115854051196928
;2019-04-28 21:30;0;3;"due to a test i took i considered that i might be an entp , but taking one look at this image was enough to not only convince me that i am not an entp , but also force me to renounce mbti altogether pic.twitter.com/KOq8NaWcvW";;;;"1122719768622927872";https://twitter.com/bojobodolls/status/1122719768622927872
;2019-04-27 18:06;0;0;"what’s your MBTI? — I am an ENTP !!! https:// curiouscat.me/mynameis152/po st/860884625?t=1556413612 …";;;;"1122306152052686848";https://twitter.com/mynameis152/status/1122306152052686848
;2019-04-27 01:21;0;1;"I am an ENTP . Glad to know you're an ESTJ.";;;;"1122053168458686465";https://twitter.com/Alter_lustrious/status/1122053168458686465
;2019-04-25 23:53;0;0;"Insight of the Day "Debaters are the most likely personality type to say that no topics should be off limits for comedy" I am an ENTP personality type A Debater A Comedian A Leader pic.twitter.com/5xVZeR1M6Q";;;;"1121668675457519616";https://twitter.com/_Rain_Revolver_/status/1121668675457519616
;2019-04-22 18:08;0;0;"I am conversing (it is called debate). That is not spamming. Can’t believe an ENTP is calling me a spammer. Check your Myers. You might be an ENFP.";;;;"1120494564274577413";https://twitter.com/redshoes721/status/1120494564274577413
;2019-04-21 12:43;0;1;"I'm an inventor; ENTP on the Myers briggs. I build motorbikes, design hifi equipment, remodel houses, and now I am designing woodwork projects. I've always got a project or three on the go.";;;;"1120050351170891777";https://twitter.com/philipcosson/status/1120050351170891777
;2019-04-19 03:33;0;3;"Thanks to @vlrvn I now know my real MBTI, I am an ENTP , hello there. pic.twitter.com/7ieF4Es5oj";;@vlrvn;;"1119187149235138561";https://twitter.com/Oubliviate/status/1119187149235138561
;2019-04-18 23:01;0;0;"Entry 2: Dear de_su, Have you ever miss someone? Is it just me, or because I am definitely an ENTP that I don't miss anyone, including my friends. Sometimes, I even doubt their "I miss you"s. I don't know how to feel about this... Or am I even capable of. Love, LuPhan";;;;"1119118926007263232";https://twitter.com/make_me_03/status/1119118926007263232
;2019-04-17 22:05;0;4;"I think I'm an ENTP . Keep in mind, ENTPs are the most introverted of the Extraverts, so it may seem like I am an INTP. #ENTP https://www. youtube.com/watch?v=j4YlA3 aZYJQ …";;;#ENTP;"1118742421372669952";https://twitter.com/TheCalebSteele/status/1118742421372669952
;2019-04-17 09:58;0;0;"I am marrying an entp pretending to do some research";;;;"1118559266976223233";https://twitter.com/LoreAdept/status/1118559266976223233
;2019-04-13 00:24;0;1;"yeonjun is an ENTP .... i am an INTP.......... this soulmateism..";;;;"1116965314606972929";https://twitter.com/yeonjunize/status/1116965314606972929
;2019-04-12 12:13;0;1;"I am without a doubt an ENTP Pisces";;;;"1116781420674940928";https://twitter.com/malnote/status/1116781420674940928
;2019-04-11 20:54;0;1;"Keselnya minta ampun sama si tour guide satu yang ini, terus dia barusan bilang, “ I am entp . You know what that means? It means I am straightforward and I am ambitious.” Terus sebelahku bilang, “or you’re just an a**hole” AKU MO NGAKAK TAPI NANTI DIPELOTOTIN GIMANA";;;;"1116550143912763393";https://twitter.com/luikaOJO/status/1116550143912763393
;2019-04-11 17:48;0;7;"#amwriting or #ampretendingtowrite My sign say, " I am an ENTP permalcurist, buy me a drink and ask me anything. pic.twitter.com/0wPzOhMcmq";;;#amwriting #ampretendingtowrite;"1116503425875763200";https://twitter.com/NoFunOverlord/status/1116503425875763200
;2019-04-10 15:17;0;0;"I think Myers Briggs is more useful, and I think the T (thinkers) that understand based on logic rather than F (feeling) types who understand based on feelings, is where communication gets challenging. I am an artist but an ENTP , so am persuaded by logic. https:// twitter.com/jerrymills/sta tus/1115851661275279360 …";;;;"1116102919957438464";https://twitter.com/paulinepdm/status/1116102919957438464
;2019-04-10 08:23;0;3;"I am an ENTP /INFJ. I swear";;;;"1115998633759895552";https://twitter.com/NoFunOverlord/status/1115998633759895552
;2019-04-09 20:48;0;0;"Myers Briggs Personality Inventory ( I am either an ENTP /ENTJ), there are 16 types total.";;;;"1115823740531691521";https://twitter.com/ThatVDOVault/status/1115823740531691521
;2019-04-09 18:52;0;0;"I am an entp so i always read more than your own personal information";;;;"1115794731404017666";https://twitter.com/LoreAdept/status/1115794731404017666
;2019-04-09 15:50;0;0;"What type of career personality are you? I am an #entj but also had another one to consider #entp so does that give me a split personality? If you know yours please share if not but your interested in knowing it the link below has a free one. https://www. careerplanner.com /";;;#entj #entp;"1115748751229050880";https://twitter.com/BamaMountaineer/status/1115748751229050880
;2019-04-09 11:04;0;3;"Re-evaluating who I am , even things like being an ENTP or a 4w5, is breaking open long-held assumptions about who I am becoming. Who I am to the people around me. Who I am to myself. I had forgotten that I’m growing within my own growth.";;;;"1115677000256106496";https://twitter.com/zechareyah/status/1115677000256106496
;2019-04-08 21:40;0;0;"Alright, I am now an ENTP . Is this the effects of being in a managerial role?";;;;"1115474563993821184";https://twitter.com/vicwolfe/status/1115474563993821184
;2019-04-08 20:19;0;3;"entp ! pisces sun pisces moon cap rising. i am an instigator who cries in public";;;;"1115454253881942016";https://twitter.com/cnidariangel/status/1115454253881942016
;2019-04-08 02:33;0;0;"My partner is an ENTP and I am an ENFP. We are a lot of fun to hang around with when anybody asks us to generate ideas and solutions for basically ANYTHING. We really suck at booking our summer holidays more than 3 weeks in advance though.";;;;"1115185997946531840";https://twitter.com/Mrs_Type/status/1115185997946531840
;2019-04-07 15:23;0;2;"i am an ISFJ and i had rory do his mbti and he is an ENTP we love to be polar opposites lmao";;;;"1115017243795054592";https://twitter.com/reallybeanie/status/1115017243795054592
;2019-04-06 08:07;1;1;"On Myers-Briggs, I am an ENTP On HBDI I am a 2311 right Brain Inventor Entrepreneur I estimate @AndrewYang is a HBDI 1111 that is a Whole Brain Chief Executive with the multi dimensional thinking preferences and problem solving processes needed for President #Yang2020 https:// twitter.com/AndrewYang/sta tus/1114255304429121536 …";;@AndrewYang;#Yang2020;"1114545218437697541";https://twitter.com/thewholesystem/status/1114545218437697541
;2019-04-05 17:44;0;0;"I am an ENTP . You are a poor presidential candidate.";;;;"1114328039062634496";https://twitter.com/PrivilegedBigot/status/1114328039062634496
;2019-04-05 15:56;0;2;"Wow I just found my old personality test results and I told twitter wrong. I am an ENTP , judge accordingly and sorry for the confusion.";;;;"1114300899730575360";https://twitter.com/GrifolsDonor/status/1114300899730575360
;2019-04-04 23:53;0;0;"I got some fresh air and maybe I am an ENTP after all. Idk i just find personaloty theory interesting. Read an MBTI book, dude!!!";;;;"1114058542577868800";https://twitter.com/shebelievesyou/status/1114058542577868800
;2019-04-04 14:21;0;0;":-) Ah! If I could choose it probably would be an ' ENTP '. And yes, you might be that, as I am borderline more extravert and can be when at home alone more like an 'INFJ'. I'm very J though! Obsessively so. Hence the favouriting of my tweets :-)";;;;"1113914455891562501";https://twitter.com/The_PPete/status/1113914455891562501
;2019-04-04 12:49;0;1;"12 years ago I was an #ENTP . I wonder if I am still.";;;#ENTP;"1113891384178675714";https://twitter.com/Pat_Tomaino/status/1113891384178675714
;2019-04-03 01:03;0;0;"Its okay. I am an entp , flirting is one of what I am good at. Wkwk";;;;"1113351380620570624";https://twitter.com/cahyadinu92/status/1113351380620570624
;2019-04-02 01:20;0;1;"I was just displaying how mean I can be sometimes. Me an ass? guilty. Maybe I am projecting, but deep inside all ENTP can be assholes. Not an excuse, merely an observation.";;;;"1112993104787857409";https://twitter.com/FarikoBrainiac/status/1112993104787857409
;2019-03-30 17:46;0;2;"i have accepted something about myself that’s taken me so long to accept.... i... am an ENTP /J";;;;"1112154218113064962";https://twitter.com/avsluvr666/status/1112154218113064962
;2019-03-27 19:20;0;3;"Culture is one of my areas of study. And the markers that define a generation are fascinating. So is identity. Plus, I am an ENTP . Complex patterns are everything.";;;;"1111090635946250242";https://twitter.com/Clumsy_Beast/status/1111090635946250242
;2019-03-27 15:52;0;1;"That's exactly how I feel! I am an ENTP .";;;;"1111038275920252928";https://twitter.com/magnoliaheartc/status/1111038275920252928
;2019-03-27 10:22;0;1;"this is similar to the big 5 traits and lessor briggs myers personality test. I am an ENTP on that so this is fairly consistent with other trait assessors.";;;;"1110955247130701824";https://twitter.com/Robfortrump2win/status/1110955247130701824
;2019-03-27 06:33;0;1;"Last thing: I am partial to the MBTI because every single time I've ever taken it, I've been an ENTP . I've taken the enneagram multiple times (just finished again for "research purposes") and it's never the same. Sometimes I'm an 8 or 6. Now I'm a 3. How is this helpful!?!?";;;;"1110897534657069056";https://twitter.com/Twitch8p9s/status/1110897534657069056
;2019-03-26 16:44;0;0;"I am an ENTP";;;;"1110688979437961216";https://twitter.com/Evershear/status/1110688979437961216
;2019-03-26 07:04;0;1;"so much of this contradicts what i think i am and also itself like.. anyway i think personality quizzes are bullshit and im an entp";;;;"1110542970498007041";https://twitter.com/hagginess/status/1110542970498007041
;2019-03-24 07:04;0;0;"Wow. I am an ENTP so Now I am more interested. Oofff I’ll go do this.";;;;"1109818342376964096";https://twitter.com/artbysimmy/status/1109818342376964096
;2019-03-22 04:26;0;0;"My answer to What is the best Myer-Brigg type for me to hire to help me action my ideas to completion in my business? I am an ENTP . https://www. quora.com/What-is-the-be st-Myer-Brigg-type-for-me-to-hire-to-help-me-action-my-ideas-to-completion-in-my-business-I-am-an-ENTP/answer/Ozzie-Ozan-Dagdeviren?share=e3d78a3d …";;;;"1109053797240922114";https://twitter.com/ozandagdeviren/status/1109053797240922114
;2019-03-19 18:12;0;0;"I am an INTP, but sometimes drift over to ENTP due to my job working in the educational sector :) https://www. 16personalities.com/intp-personali ty …";;;;"1108174562628390912";https://twitter.com/DanielGallagher/status/1108174562628390912
;2019-03-17 20:05;0;1;"I flip and flop between ENFP and ENTP (wth an occassional venture into ENFJ - but only occassional). I am EXTREMELY strong EN though. #GoalChat";;;#GoalChat;"1107478016626692101";https://twitter.com/Kathrynclang/status/1107478016626692101
;2019-03-13 02:05;0;0;"I am ENTP , most similar to jin. But the thing is sometimes I'm and extrovert, sometimes an introvert. It depends on when i take the test. https:// twitter.com/inexactbts/sta tus/1105668233540046848 …";;;;"1105756686390722560";https://twitter.com/hanaljufri/status/1105756686390722560
;2019-03-12 13:28;0;0;"I really identify with my type and the tumblr mbti group really made me understand loops and made em realise when I was in one and I used that info to grow so both I guess I am an ENTP so I really identify with functions. I am gonna do my dissertation in uni on this.";;;;"1105566238401576960";https://twitter.com/sanguinehoney/status/1105566238401576960
;2019-03-12 12:44;0;0;"I am having a sweet and wonderful dream that a sweetly sentimental violet-eyed ENTP lady, really quite breathtaking, waving long and lustrous hair off her face while pulling on a celadon denim kimono, sings softly to an attentive but chestnut palomino.";;;;"1105555235316084737";https://twitter.com/MBTIhorsewomen/status/1105555235316084737
;2019-03-12 04:29;1;2;"My name is @AaronRZiegler . I have Bipolar Disorder. I have High-Functioning Autism. I am Ambiverted as a ENTP & INTJ. I am Ambidextrous. I have Hypergraphia. I have Hyperlexia. I have an IQ of 185-210. (IQ according to Weschler-Binet).";;@AaronRZiegler;;"1105430526209478656";https://twitter.com/AaronRZiegler/status/1105430526209478656
;2019-03-12 04:25;1;1;"My name is @AaronRZiegler . I have Bipolar Disorder. I have High-Functioning Autism. I am Ambiverted as a ENTP & INTJ. I am Ambidextrous. I have Hypergraphia. I have Hyperlexia. I have an IQ of 185-210. (IQ according to Weschler-Binet).";;@AaronRZiegler;;"1105429527784755202";https://twitter.com/AaronRZiegler/status/1105429527784755202
;2019-03-11 20:12;0;0;"Retook the personality test and now I am an ENTP and not an ENTJ? Haha lol";;;;"1105305530245894144";https://twitter.com/SlytheReine/status/1105305530245894144
;2019-03-10 14:01;0;1;"God of course youre an entp . i am too. it just fucking checks out";;;;"1104849796097990657";https://twitter.com/nen_user/status/1104849796097990657
;2019-03-09 23:53;0;1;"so I might be an ENFP but I do not crave social interactions. I might be an ENTP but I am not ignorant of people's emotions in an argument. I might even be an ENTJ because myer briggs showed that result along with the first two. just tell me which mbti has yeehaw moments for INTP";;;;"1104651352045547520";https://twitter.com/taeoverflowers/status/1104651352045547520
;2019-03-09 19:04;0;0;"This test is so accurate based on my type. Try it and share your type below. I am an ENTP , and if you know me well you'll know I always play devil's advocate in a conversation much to other's Chagrin. https://www. facebook.com/1303326888/pos ts/10218674106506162/ …";;;;"1104578688006455296";https://twitter.com/TheQueenofMedia/status/1104578688006455296
;2019-03-09 00:41;0;1;"i can now safely say i am definitely an entp . all confusion cleared up lol";;;;"1104301120472735744";https://twitter.com/gl_tchb0t/status/1104301120472735744
;2019-03-08 15:46;0;0;"I am a dom/switch, aries sun, taurus moon. Also ENTP on an unrelated note.";;;;"1104166549407977472";https://twitter.com/NoFunOverlord/status/1104166549407977472
;2019-03-06 03:29;0;0;"idk.. i took the test before and the result stated that i am an entp";;;;"1103256349603856385";https://twitter.com/weishengods/status/1103256349603856385
;2019-03-05 12:44;0;2;"I am ENTP too but pretend I'm an ENFJ so people like me";;;;"1103033485088841733";https://twitter.com/heyitsbunker/status/1103033485088841733
;2019-03-03 12:24;0;1;"I've switched from an ENTP to an ENTJ";;;;"1102303660304850944";https://twitter.com/i_am_mr_krabs/status/1102303660304850944
;2019-03-02 17:32;0;2;"And yes, in the year 2019 I am still running around and looking for characters with my MBTI type. I don't think it's particularly useful as a measuring tool, but it's entertaining at the least. Also, Camus is an ESTJ. Whoever claims he's an ENTP isn't paying attention.";;;;"1102018914526134274";https://twitter.com/ShadowSakazaki/status/1102018914526134274
;2019-03-02 11:35;0;0;"Is being an entrepreneur weird? There's a Myers-Briggs study that will help you understand yourself ( I am an ENTP ) what are you? @jmbrandonbb https://www. inc.com/john-brandon/m yers-briggs-just-discovered-there-is-a-personality-type-for-entrepreneurs.html … via @Inc";;@jmbrandonbb @Inc;;"1101929051999162369";https://twitter.com/trish_lessard/status/1101929051999162369
;2019-03-01 06:53;0;5;"Today I got asked by a colleague if I am an ENTP . So I’m basically questioning that whole authenticity thing right now.";;;;"1101495758111547393";https://twitter.com/RockstarINFP/status/1101495758111547393
;2019-02-27 15:05;0;1;"when u take a personality test they say what kinf person you are and i am an entp ( extroverted intiuiting thinking perceiving )";;;;"1100894724494286849";https://twitter.com/fatebringsyou/status/1100894724494286849
;2019-02-26 10:02;0;0;"i am a sagittarius, so according to this i should be entp . but my dominant sign is pisces and actually i'm an enfp but i'm not far from entp either, the thinking-feeling percentage i got was almost 50-50. but i relate the most with the enfp personality";;;;"1100455964292071424";https://twitter.com/alesaprincipesa/status/1100455964292071424
;2019-02-22 07:44;0;0;"I am having a sweet and quick-witted dream that Eir, an exquisitely wondrous redheaded and amethyst-eyed ENTP lass, sporting her lavender blue beret, shares an intimate moment with a cute silver dapple, with black points, Friesian Sporthorse.";;;;"1098971815563669504";https://twitter.com/MBTIhorsewomen/status/1098971815563669504
;2019-02-20 23:09;0;2;"One of my associates somehow got me to open up.. compared me to an onion. Now I am “sad girling” the night away.";;;;"1098479805618622464";https://twitter.com/lady_entp/status/1098479805618622464
;2019-02-20 19:33;0;0;"I don’t know what a 1488 NPC is. I am an ENTP who uses facts, statistics, and data to arrive at logical conclusions. I don’t feel some type of way because my feeeeewwwwwwlings get hurt. I’m a chef. And I’m in the kitchen and I’m cooking, yams everywhere. pic.twitter.com/cpGqoH2Fcj";;;;"1098425552992497664";https://twitter.com/KeithDobi3/status/1098425552992497664
;2019-02-20 17:06;0;1;"This calls for an Adam Schiff investigation... I am sure the Russians are involved. https:// twitter.com/FLYER995/statu s/1098382415091941376 …";;;;"1098388361272877056";https://twitter.com/ENTP_MBA/status/1098388361272877056
;2019-02-19 18:41;0;2;"I’m not okay and that’s okay. Anyway I made this earlier and laughed at myself because I’m an Aquarius Moon and also an ENTP and the only thing both know how to do in times of stress is to be goofy af. I am sorry. pic.twitter.com/4IRZq8Y4Hn";;;;"1098049861512032258";https://twitter.com/SerenaSonoma/status/1098049861512032258
;2019-02-19 15:17;0;0;"you’re an entp ? i am an intj :)";;;;"1097998549042765824";https://twitter.com/newkidskontinue/status/1097998549042765824
;2019-02-19 14:54;0;1;"This resonates with me a ton and actually is rather ironic as an ENTP with Fi being my weakest function I am aware of whats going on in my stomach of what my emotions actually are but generally im used to dealing with conflict with Fe so I am SUPER uncomfortable with Fi.";;;;"1097992796663934977";https://twitter.com/sebENTP/status/1097992796663934977
;2019-02-19 13:19;0;2;"If it means anything, I am quite sure I am ENTP and it's the same for me recently. It might be that my grasp on the difference between social anxiety and being an introvert is bad, but I gave up being extroverted and social in my last year of high school.";;;;"1097968862887403520";https://twitter.com/chaoticIars/status/1097968862887403520
;2019-02-19 11:08;0;1;"I am an ENTP";;;;"1097936044060758017";https://twitter.com/pamushiberia/status/1097936044060758017
;2019-02-18 22:00;0;2;"I have officially decided that I am an ENTP and not an INTP based on a lot of research and analysis of both types. This matters not to most of you, but I needed to share. Thank you for listening.";;;;"1097737773128314880";https://twitter.com/peterz3g/status/1097737773128314880
;2019-02-15 22:42;3;24;"ISTP: I am both bad and an ass: badass INTP: mottos do not make sense ESTP: Just Do It Irresponsibly ENTP : be a circle, have infinite sides ISFP: I don’t know, therefore I am INFP: go after what you can’t have ESFP: wild as a lion, soft as a pussy ENFP: enough is not enough";;;;"1096660954581028865";https://twitter.com/CogFun/status/1096660954581028865
;2019-02-13 12:38;0;7;"Now that I know I am an ENTP I think I’m quickly becoming more and more ENTP";;;;"1095784389081026562";https://twitter.com/eliseengle/status/1095784389081026562
;2019-02-13 09:53;0;0;"Were they ENTP , INTP, and INTJ? You seem somewhat introverted as a person. But you may be an ambivert, like me. I am a shy extrovert who can’t shut up, and hates to be the center of attention, although I always am. TMI is my MO.";;;;"1095742685749657601";https://twitter.com/Clumsy_Beast/status/1095742685749657601
;2019-02-12 18:15;0;0;"Oh okay. Ik I’m an entp but I forget which one I am betweet a or t";;;;"1095506709701898240";https://twitter.com/yoonhoneyy/status/1095506709701898240
;2019-02-11 10:28;0;1;"I'm not saying that he's not an entp I am just saying that you are not him He is a vindictive, petty, self pitying bigot who strives for the most unhealthy coping mechanisms possible and refuses to adapt at all costs";;;;"1095026898692964352";https://twitter.com/chadfuture_/status/1095026898692964352
;2019-02-10 19:17;0;0;"Such is the life of an ENFP. I am ENTP , but I share many traits with an F. It will be ok. Follow your guiding principles, engage your family, and don't be afraid to tell someone to GFY. My best skill is making lemonade from lemons. It comes in handy.";;;;"1094797607275298816";https://twitter.com/CaptainMerca1st/status/1094797607275298816
;2019-02-10 19:08;0;0;"Well the theory of socionics has an additional step to the mbti one which states that individuals have an additional subtype, For instance I am ENTP Ti subtype meaning that my dominant function is Ne but I have a strong proclivity to display Ti and have it very well developed";;;;"1094795181449187330";https://twitter.com/sebENTP/status/1094795181449187330
;2019-02-08 01:28;0;3;"I really wanna do this but it’s so much fun :( I am an ENTP type personality. I love debates! But im trying pic.twitter.com/QZd0aTFcCY";;;;"1093803693198069760";https://twitter.com/KimNamJunnie/status/1093803693198069760
;2019-02-07 07:31;0;1;"I almost thought youre an ENTP coz I am ! Hahah pic.twitter.com/8Rv2gJPhaV";;;;"1093532674524819457";https://twitter.com/noymisu/status/1093532674524819457
;2019-02-06 06:24;0;0;"(English translation) I'm often judged ENTP or INTP, so it means maybe I am an ambiversion person, so why there's no Type (A)NTP-T ? #mbti";;;#mbti;"1093153578955419650";https://twitter.com/b1ueskydragon/status/1093153578955419650
;2019-02-04 12:08;0;0;"I am actually an ENTP “the debater” and an intellectual in general but any man that wants to debate on first encounters is not going to win me over romantically he may just be a great thought sparring partner, aka “friend zoned”";;;;"1092515328486199303";https://twitter.com/taylorburrowes/status/1092515328486199303
;2019-02-04 09:02;16;433;"@TheDeverakonda I am 20, I have started an NGO Education improvement kosam. Meru ma lanti valani encourage chesta We can make more celebrities even. hope you will help and support us in our activities. Want to meet you in personal sir for atleast 15 min of your valuable time.";;@TheDeverakonda;;"1092468424515567616";https://twitter.com/akshay_entp/status/1092468424515567616
;2019-02-03 18:54;1;1;"I was in my schools invite only directing class, have a background in sketch and screen/playwriting. I mean, you've seen how much I can contribute while not being paid, and how warm and supportive I am . So if you need an ENTP /Tyrion Lanister, consider me. If not, totally cool.";;;;"1092255065572704258";https://twitter.com/PaulRoberson/status/1092255065572704258
;2019-02-02 09:57;0;0;"Ppl of mbti, help needed. So ive read Exxx in socionics and found that the most suiting is entp or esfj. Here i am thinking myself as an enfp. What am i thinking?";;;;"1091757480135221248";https://twitter.com/flowerlec/status/1091757480135221248
;2019-02-02 07:54;0;3;"And here I am , still an ENTP , but with a strong assertive tendency. Personality type: “The Debater” (ENTP-A) Individual traits: Extraverted – 90%, Intuitive – 78%, Thinking – 51%, Prospecting – 79%, Assertive – 79% Role: Analyst Strategy: People Mastery";;;;"1091726612910034949";https://twitter.com/GottTechCoach/status/1091726612910034949
;2019-01-31 11:25;0;0;"Interesting I am an inveterate test taker, and in all the times I’ve taken the test I always got ENTP .";;;;"1091054888111484928";https://twitter.com/jposhaughnessy/status/1091054888111484928
;2019-01-29 10:51;0;2;"Finding the path to be a “perfect” man or woman, that image of you you think could present the best of you is not what I am really interested in.I prefer to make an improvised aesthetic path not a yet another boring success story to a pre-defined top of the mountain. #ENTP much?";;;#ENTP;"1090321456548982784";https://twitter.com/samierni/status/1090321456548982784
;2019-01-27 13:49;0;0;"I am an entp a beauty n not sorry for that mm :)";;;;"1089641620750954497";https://twitter.com/demodeamamemode/status/1089641620750954497
;2019-01-25 15:56;0;2;"I used to swear I was an extrovert & desirous of acceptance and fame from all, but I’ve realize & more importantly *remembered* that I am not those & do not desire such attention. I used to score as an #ENTP , but after almost two years of working & learning I score as a #INFP -t";;;#ENTP #INFP;"1088948647390134272";https://twitter.com/gr3g0rythw4nd3r/status/1088948647390134272
;2019-01-23 13:53;0;0;"I AM an ENTP lol it's what we do for fun, but my main concern is not letting people slip into frenzies, I agree racism is a problem completely, but i see it escalating to a point of violence where in 2005 everything seemed relatively calm, I dont want to see a race war happen";;;;"1088192994929528832";https://twitter.com/RichHommieJohn/status/1088192994929528832
