username;date;retweets;favorites;text;geo;mentions;hashtags;id;permalink
;2017-08-07 19:31;0;1;"We just figured out that Donte is an ENTP and I am an ISFJ and now our relationship makes so much more sense #oppositesattract";;;#oppositesattract;"894747798771425282";https://twitter.com/saraeliiz/status/894747798771425282
;2017-08-04 11:33;0;0;"I am an ENTP . This is very accurate. Thanks for sharing Kevin L. Matthews II... http:// fb.me/9bcYLsUDb";;;;"893540438887604228";https://twitter.com/MrImprobable1/status/893540438887604228
;2017-08-03 14:27;0;0;"As an ENTP it's who I am to seek to constantly improve and challenge the status quo to get the best outcome. Intelle… https:// lnkd.in/gjupXQD";;;;"893221738846105601";https://twitter.com/sottykiwi/status/893221738846105601
;2017-08-03 02:02;0;1;"I am an ENTP - Very Close to yours.";;;;"893034438380187648";https://twitter.com/maggiereads/status/893034438380187648
;2017-08-02 11:30;0;0;"This was fun. Turns out I am an ENTP ,-A, -T Debater Personality. Sounds about right. No idea what the ENTP , -A, -T is all about... https:// twitter.com/SouthernKeeks/ status/892809724659412996 …";;;;"892814956667777030";https://twitter.com/jjgiorgis/status/892814956667777030
;2017-08-01 20:15;0;2;"I just retook a Meyers Briggs and apparently now I'm an ENTJ which I am very conflicted about I will miss my former ENTP brethren.";;;;"892584647791710208";https://twitter.com/KristinaLuca/status/892584647791710208
;2017-07-31 15:34;0;1;"I've heard that I am an ENTP that helps people change their opinions of the type. haha.";;;;"892151633777369088";https://twitter.com/NoFunOverlord/status/892151633777369088
;2017-07-31 15:13;0;1;"I am an ENTP apparently folks, the same as The Joker, Jack Sparrow and Tyrion Lannister";;;;"892146152023482369";https://twitter.com/BooRadAllie/status/892146152023482369
;2017-07-29 08:57;0;1;"I am an ENTP";;;;"891326936676433922";https://twitter.com/IAM_DJ_Michael/status/891326936676433922
;2017-07-28 22:13;0;0;"I read an infographic on Pinterest and I am an ENTP too so it's OK.";;;;"891164687420620800";https://twitter.com/The_Dull_Roar/status/891164687420620800
;2017-07-27 23:44;0;1;"HE MAY BE AN ENTP BUT HES ALSO EXTREMELY CUTE i am a furry";;;;"890825158017110016";https://twitter.com/bearrible/status/890825158017110016
;2017-07-27 12:09;0;0;"I can never see reference to Myers Briggs without having to go back to an online test and work out which I am . #entp";;;#entp;"890650409261568001";https://twitter.com/taffygweilo/status/890650409261568001
;2017-07-26 07:39;0;1;"Of course not, because I am an ENTP . (LOL)";;;;"890220131774853120";https://twitter.com/DDucheyne/status/890220131774853120
;2017-07-24 20:37;0;2;"Omg hello I am also an ENTP";;;;"889690958278922240";https://twitter.com/juliarwaits/status/889690958278922240
;2017-07-12 19:26;0;0;"I am an INTP. But it seems like I might turn into ENTP or ENTJ. Is it normal? Seems unreal to me.";;;;"885324456939462656";https://twitter.com/cryptsen/status/885324456939462656
;2017-07-11 16:42;0;0;"And yes, you probably won't be surprised but I am an ENTP";;;;"884920832031682564";https://twitter.com/JoeLentini/status/884920832031682564
;2017-07-09 11:04;0;0;"I am an INTJ- Shadow aspects are ENTP . INTJ is, Introverted intuition, Extraverted Thinking, Introverted Feeling, Extraverted Sensing. #Love";;;#Love;"884111120885329920";https://twitter.com/Unc0l0ured1/status/884111120885329920
;2017-07-05 20:42;0;5;"The only famous person that I am 100% sure was an ENTP https:// twitter.com/proffeynman/st atus/861021439436050432 …";;;;"882806827095904256";https://twitter.com/CogFun/status/882806827095904256
;2017-07-03 12:59;1;3;"finally figured it out that I am not an extroved version of an #INTP , but a true #ENTP . What a relief. Thanks to @PersonalityHack";;@PersonalityHack;#INTP #ENTP;"881965519972294656";https://twitter.com/MichaHugels/status/881965519972294656
;2017-07-03 07:35;0;0;"As an ENTP , I am literally a lil extro vert.";;;;"881884203503292416";https://twitter.com/JBadaman/status/881884203503292416
;2017-07-02 04:37;0;3;"I am an ENTP , Capricorn cusp Aquarius, Wood Rabbit Gryffindor with zero fucks as to what all the above means. pic.twitter.com/XL4hDuP0l5";;;;"881476953655476225";https://twitter.com/delaneykingrox/status/881476953655476225
;2017-07-01 22:17;0;4;"Update: I am apparently an ENTP but we all know I'm really an Aria";;;;"881381325541961728";https://twitter.com/TyJamesHenson/status/881381325541961728
;2017-06-29 20:25;0;1;"I am an ENTP . pic.twitter.com/9ZL9B23tHn";;;;"880628291027292160";https://twitter.com/MillyFerg/status/880628291027292160
;2017-06-29 09:16;0;0;"I am an ENFP and I honestly think the most attractive type other than mine is ENTP .";;;;"880459933430366208";https://twitter.com/minkkyunga/status/880459933430366208
;2017-06-25 00:51;0;1;"key is an entj i am an entp /j cusp ya'll i KNEW it";;;;"878883395828187136";https://twitter.com/RedSharkey/status/878883395828187136
;2017-06-24 17:43;0;2;"I am an ENTP . Hugs waste time and are weird. Fist bump and get to the reason we are together.";;;;"878775552861241344";https://twitter.com/pastortimbrooks/status/878775552861241344
;2017-06-24 08:08;0;5;"i just realized..... all my friends are INTP/INTJ/ ENTP /etc ... I AM SURROUNDED BY Ne and Te... None of you fuckers is an ISTP or ISFP or...?";;;;"878630876992634881";https://twitter.com/atypical_chiss/status/878630876992634881
;2017-06-21 02:55;0;0;"look im an entp i am a Sucker for development in all forms AND i like think tank jobs that test my creativity";;;;"877464961844301824";https://twitter.com/hyungwons_/status/877464961844301824
;2017-06-20 18:39;0;0;"Yeah. Anyway...conclusion: I am obsessive about random things I am both an ENTP and an ENFP. An ENxP";;;;"877340197817643008";https://twitter.com/that_girl_viwe/status/877340197817643008
;2017-06-19 17:46;0;1;"I tried again, and now it is saying that I am an Ne dom ( ENTP ). The items are highly stereotyped - Fi aside, I don't find this a good tool.";;;;"876964339013611520";https://twitter.com/artemidite/status/876964339013611520
;2017-06-19 13:34;2;5;"It's official.... I AM AN ENTP ! . Thanks @IngrajJenny for another fab AHPQI day, great learning with a great team! @NHSGrampian @WeAHPs pic.twitter.com/X90sQSsjhV";;@IngrajJenny @NHSGrampian @WeAHPs;;"876901114750263296";https://twitter.com/Leigh_Porter1/status/876901114750263296
;2017-06-15 09:47;0;0;"I am an ENTP in limbo. I can't lay roots or develop community around me because I feel so transitory.";;;;"875394305136918530";https://twitter.com/NoFunOverlord/status/875394305136918530
;2017-06-15 00:21;0;0;"yes, i am an ENTP debate me";;;;"875251820565676032";https://twitter.com/CaptainFuckable/status/875251820565676032
;2017-06-14 06:28;0;0;"never mind i am an ENTP after all https:// twitter.com/taeslani/statu s/874683082598756352 …";;;;"874981823331184641";https://twitter.com/dansmiti/status/874981823331184641
;2017-06-11 06:29;0;0;"But I am an ENTP ........";;;;"873894981710209024";https://twitter.com/gukieds/status/873894981710209024
;2017-06-11 00:39;0;1;"I just retook the personality test like 5 times on different sites and I am an ENTP now I guess";;;;"873806998927581184";https://twitter.com/wishfulmelody/status/873806998927581184
;2017-06-11 00:11;0;0;"im always an entp wth i am not an entp am i entp ????? whatta what";;;;"873799923216633856";https://twitter.com/nxctem/status/873799923216633856
;2017-06-10 22:33;0;1;"In case y'all suddenly get interested in mbti i am an ENTP , anyone else?";;;;"873775183294853121";https://twitter.com/candychims/status/873775183294853121
;2017-06-10 21:37;0;0;"i am an entp for the curious soul";;;;"873760957713068032";https://twitter.com/chuuwys/status/873760957713068032
;2017-06-08 08:53;0;0;"I am an ENFP. I tell people that if I was an ENTP I would be Steve Jobs. In this article the iNtuitive/Perceiving tr… https:// lnkd.in/gJbRzQN";;;;"872844017989410816";https://twitter.com/bennysaw/status/872844017989410816
;2017-06-05 10:08;2;12;"I hung out with an #ENTP last night. I am *royally* hung over today.";;;#ENTP;"871775862416330752";https://twitter.com/ESFPdiscourSe/status/871775862416330752
;2017-06-05 07:38;0;0;"i just took the mbti test again twice and instead of an intp i am apparently entp now";;;;"871738071825264643";https://twitter.com/lovechaehw/status/871738071825264643
;2017-06-01 00:49;0;0;"I am an ENTP . Steve Jobs and Thomas Edison was ENTP . Btw, as an ENTP ; I usually love talking to INTPs and ENTJs!";;;;"870185453646864385";https://twitter.com/Mitsecode/status/870185453646864385
;2017-05-30 21:59;0;1;"I am as well. " I am the common denominator and independent variable" is a good inner-mantra. I am now an ENTP , I used to be an INTP.";;;;"869780324431142914";https://twitter.com/AaronRZiegler/status/869780324431142914
;2017-05-26 17:27;0;1;"I wonder which type I am . But I'll guess ENTP or ENTJ, although I wish I was a INTP but there's no way I'm an "I" http:// observer.com/2017/05/what-k ind-of-traveler-myers-briggs-personality-type/ …";;;;"868262380467343361";https://twitter.com/equanimitii/status/868262380467343361
;2017-05-24 21:43;0;1;"The internet told me I am an ENTP and now I'm just sitting here awaiting ultimate judgement.";;;;"867602018935988224";https://twitter.com/BrianValentine/status/867602018935988224
;2017-05-24 18:04;0;0;"So I am a #multipotentialite and an ENTP . I should probably have a talk show.... https:// twitter.com/tedtalks/statu s/867515204841680896 …";;;#multipotentialite;"867546935124799489";https://twitter.com/John_Simensen/status/867546935124799489
;2017-05-19 21:46;5;5;"i am depressed and as an entp i always have the energy to fight ppl. where is ur god now";;;;"865790900500185088";https://twitter.com/SARTROSE/status/865790900500185088
;2017-05-18 19:51;1;0;"I am voting for BTS for TOP SOCIAL ARTIST at the #BBMAs . RT to vote! #BTSBBMAs I always get typed as intp but I think I might be an entp";;;#BBMAs #BTSBBMAs;"865399598298300416";https://twitter.com/GBhadal/status/865399598298300416
;2017-05-16 14:38;0;0;"#rio2016 #Olympic http:// smarturl.it/SaraJarlous I am not an ENTP ? via #entp http:// smarturl.it/SaraJarlous pic.twitter.com/FnVvFD5X5X";;;#rio2016 #Olympic #entp;"864596047808671745";https://twitter.com/SaraJarlous/status/864596047808671745
;2017-05-12 15:45;0;0;"wait wait wait wait wait wait wait wait wait wait w... — according to 16personalities dot com i am an entp w... https:// curiouscat.me/hoshiko/post/1 47549951?t=1494629123 …";;;;"863163223700373504";https://twitter.com/meowlennial/status/863163223700373504
;2017-05-11 15:43;0;0;"You know you're an ENTP when #89 - netifesi: if everyone you knew from all your circles was in the same... https:// tmblr.co/Z49RNy2LYPEJb";;;#89;"862800431973416960";https://twitter.com/cham_i_am/status/862800431973416960
;2017-05-11 07:32;0;3;"I am an ENTP and I always thought that Tai is one";;;;"862676869254176770";https://twitter.com/Motalameen/status/862676869254176770
;2017-05-07 10:48;0;0;"To take an MBTI test go to this website called 16personalities.. I am an ENTP btw i vote for @BTS_twt Top Social Artist Award #BTSBBMAs";;@BTS_twt;#BTSBBMAs;"861276659772563456";https://twitter.com/shrimphakau/status/861276659772563456
;2017-05-05 17:13;0;2;"Yes, math and philosophy (minor). Not sure how much more Ti I could get. But since I *am * an ENTP , it's important that I develop it actively";;;;"860648680013131776";https://twitter.com/intpclaire/status/860648680013131776
;2017-05-03 10:44;0;0;"INTJ sympathizer, my darling is an INTJ, I am ENTP .";;;;"859826096891731968";https://twitter.com/DrawBeyondLines/status/859826096891731968
;2017-04-28 16:18;0;0;"I am an ENTP . What are you? http:// fb.me/65yyRhMwT";;;;"858098121703915521";https://twitter.com/AirTightness/status/858098121703915521
;2017-04-26 11:45;0;7;"ENTP : Wine tasting? What are you, an eighty-year-old? Me: Yes, I am . And how old are you? ENTP : I'm a ten-year-old at heart.";;;;"857304626684710920";https://twitter.com/idealistmuse/status/857304626684710920
;2017-04-25 08:56;0;0;"16. apparently i am an entp ???? and also a ravenclaw aND MY PATRONUS is a snow leopard!!!";;;;"856899620948951040";https://twitter.com/sassyneki/status/856899620948951040
;2017-04-24 02:19;0;1;"I was thinking the same thing. lol, good fiction helped me be who I am today!!!!! maybe it's an entp thing, why we are seen as characters";;;;"856437379195908096";https://twitter.com/EntpHub/status/856437379195908096
;2017-04-21 17:12;0;1;"Yes, I am an ENTP .";;;;"855575017094074368";https://twitter.com/ENTPproblems/status/855575017094074368
;2017-04-20 06:58;0;0;"Haha I am an ENTP and where is the lie in this???? https:// twitter.com/dirtgirI/statu s/854561594113699840 …";;;;"855058181562572800";https://twitter.com/allanplusdale/status/855058181562572800
;2017-04-20 06:22;0;0;"What are you? I am an ENTP with burst of INTP on some tasks (old engineering days) #MBTI http:// intel.ly/2on1x4k";;;#MBTI;"855049090975113216";https://twitter.com/diegoalco/status/855049090975113216
;2017-04-20 01:55;0;0;"Which one are you? I wonder if there is a trend with people with social anxiety? I am an ENTP … https://www. instagram.com/p/BTGepXHBbL3/";;;;"854981963928682496";https://twitter.com/StrongSocially/status/854981963928682496
;2017-04-18 14:30;0;0;"30 Things I’ve Learned In 30 Years About Life, Love And Anxiety As An ENTP #strengt ... http:// thoughtcatalog.com/ioana-casapu/2 017/04/30-things-ive-learned-in-30-years-about-life-love-and-anxiety-as-an-entp/ … pic.twitter.com/0fY0m2jlaR";;;#strengt;"854446964838191109";https://twitter.com/I_am_positivee/status/854446964838191109
;2017-04-16 22:25;1;5;"anyway hi hello i am an entp gryff alpha";;;;"853841948141953024";https://twitter.com/taeharem/status/853841948141953024
;2017-04-13 18:10;0;1;"So you don't have to wonder, I am an ENTP (or at least 10 years ago in college I was). As for the other... I took a free test that says 4w3";;;;"852690509999083520";https://twitter.com/LaReineLaTina/status/852690509999083520
;2017-04-12 22:17;0;0;"Oh goddamn you bloody nailed it I am indeed an ENTP";;;;"852390258188603392";https://twitter.com/Jasspls/status/852390258188603392
;2017-04-12 20:32;2;9;"Bottom line: I am a really silly, moderately outgoing INTP, not an ENTP .";;;;"852363954475106304";https://twitter.com/intpclaire/status/852363954475106304
;2017-04-12 08:55;0;6;"So... I am an #INTP with a close #INTJ friend and #ENTJ brother. If I meet an #ENTP does that spell danger for world domination? #jest";;;#INTP #INTJ #ENTJ #ENTP #jest;"852188392620257280";https://twitter.com/belatedINTP/status/852188392620257280
;2017-04-11 18:38;0;1;"I am an ENTP personality type, what type are you? pic.twitter.com/837gzBdySH";;;;"851972788923584512";https://twitter.com/amandaward42/status/851972788923584512
;2017-04-08 14:38;0;0;"having an entp personality type apparently means that I am more like guy characters smh";;;;"850825236941488128";https://twitter.com/mcuanakin/status/850825236941488128
;2017-04-03 09:35;0;0;"I re-did my personality test and i am still an ENTP . alright alright.";;;;"848937015190183936";https://twitter.com/LightBeardani/status/848937015190183936
;2017-04-01 21:08;0;0;"Not confirmed, but I am quite certain my math teacher is an ENTP . There would be times I thought I grew up and travelled back in time as him";;;;"848386585276145664";https://twitter.com/leftbrainegg/status/848386585276145664
;2017-03-31 18:38;0;0;"For those wondering I am an ENTP";;;;"847986445478502400";https://twitter.com/ElliottBelardo2/status/847986445478502400
;2017-03-30 10:46;0;2;"every single person on the internet: I Am an INFP/INTJ/ ENTP /INTP/INFJ";;;;"847505435691110400";https://twitter.com/halshogging/status/847505435691110400
;2017-03-28 08:20;0;0;"Max Loughan is a INTP. I am an ENTP . I hope Max Loughan accomplishes in free energy that which is the goal: zero-point energy";;;;"846743733068554241";https://twitter.com/AaronRZiegler/status/846743733068554241
;2017-03-27 05:22;0;0;"I am an ENTP . Go read what that is, it nearly describes me to perfection.";;;;"846336714595454976";https://twitter.com/GeomancyGames/status/846336714595454976
;2017-03-25 20:04;0;1;"i am an entp but idk what that means i just took a test";;;;"845833902430269440";https://twitter.com/panxcea/status/845833902430269440
;2017-03-24 11:52;0;0;"Do I need to follow an ENTP twitter to better understand my friend...probably. God's above! I am the worst.";;;;"845347648064315392";https://twitter.com/Vip_Jo19/status/845347648064315392
;2017-03-23 05:32;0;1;"I am ALSO an ENTP . Life is weird man";;;;"844889559628312576";https://twitter.com/RayleeJane/status/844889559628312576
;2017-03-22 01:49;0;0;"Found an INFJ in the office, and I think I am flirting with him, lol .. And, in the same time, I am flirting with an ENTP from old office";;;;"844471144874819584";https://twitter.com/shimslave/status/844471144874819584
;2017-03-21 21:12;0;0;"“I was bored, so I went on Google and I found this…” - An ENTP , 165328 times a day #nailedit";;;#nailedit;"844401278742659073";https://twitter.com/cham_i_am/status/844401278742659073
;2017-03-21 21:11;0;0;"“I was bored, so I went on Google and I found this…” - An ENTP , 165328 times a day (via snobmushroom) https:// tmblr.co/Z49RNy2Jolsco";;;;"844401092343611400";https://twitter.com/cham_i_am/status/844401092343611400
;2017-03-20 14:28;0;0;"My answer to People are correlating zodiac signs to MBTI types as if it makes sense. Well I am an ENTP and my zodia… https://www. quora.com/People-are-cor relating-zodiac-signs-to-MBTI-types-as-if-it-makes-sense-Well-I-am-an-ENTP-and-my-zodiac-sign-is-cancer-What-do-you-say-about-that/answer/Dunnea-Artemis-Rae?srid=TLH9 …";;;;"843937262723350529";https://twitter.com/alohaastro/status/843937262723350529
;2017-03-18 21:28;0;4;"I am an entp with a fever I don't know what I'm saying";;;;"843318199672324096";https://twitter.com/KingKeyl/status/843318199672324096
;2017-03-15 14:16;0;0;"@ReunionHill per some real and true science, i used to be an enfp but now i am an entp . i no longer feel. i know only the sword.";;@ReunionHill;;"842122386526859264";https://twitter.com/prendella/status/842122386526859264
;2017-03-14 18:27;2;12;"I am an ENTP and I would like to retire to my grave.";;;;"841823054032441345";https://twitter.com/CogFun/status/841823054032441345
;2017-03-07 09:08;1;1;"@kelseywhale I hate you bc I just retook the MBTI and I am also an ENTP now";;@kelseywhale;;"839160822710456322";https://twitter.com/Catreenahh/status/839160822710456322
;2017-03-06 08:55;0;0;"but what if i choose to write i am an entp in my thing. wud this not encourage speculation";;;;"838795102113812480";https://twitter.com/TROUTPOP/status/838795102113812480
;2017-03-05 17:54;0;0;"@harleyjinx I liked you ENTP vid, was pretty accurate as an ENTP myself. I am going to Europe this summer, can you recommend some places?";;@harleyjinx;;"838568559173320704";https://twitter.com/julienamorgan/status/838568559173320704
;2017-02-27 23:30;0;0;"Man I'm an ENTP . I have explored all types endlessly- and I admit- classic entp sounds 7, yet I am a 3.";;;;"836478542976266240";https://twitter.com/ShaunJReeve/status/836478542976266240
;2017-02-24 17:48;0;0;"Not surprising i am an ENTP LOL. https://www. 16personalities.com/entp-personali ty …";;;;"835305316472524801";https://twitter.com/oufire19/status/835305316472524801
;2017-02-23 06:48;0;0;"I met an ENTP girl and Iam feeling like I am flirting with her, lololol.";;;;"834777057515040768";https://twitter.com/shimslave/status/834777057515040768
;2017-02-22 11:23;0;1;"Slowly changing from an ENTP to an INTP and I am ok with it";;;;"834483792458887169";https://twitter.com/CaseSandberg/status/834483792458887169
;2017-02-17 09:00;0;1;"tbh I'm joking I just think horoscopes are fun as hell. I am an ENTP with a super strong intuition. I feel ya on all that";;;;"832635822587260929";https://twitter.com/jessfrr/status/832635822587260929
;2017-02-16 21:19;0;6;"just retook the myers briggs test three times & i am an enfp, esfp, and entp all at once. do i have a personality type disorder?";;;;"832459512699162626";https://twitter.com/crazy4patswayze/status/832459512699162626
;2017-02-16 12:32;0;0;"#ENTP in flow is an amazing thing... I am having a lovely afternoon of it! Today is ramping up to be great!";;;#ENTP;"832326735345520640";https://twitter.com/NoFunOverlord/status/832326735345520640
;2017-02-11 17:54;0;3;"Ok so I am either an INFJ or an ENTP and they are literally totally diff but I cannot figure it out.";;;;"830595835075309568";https://twitter.com/vie_eros/status/830595835075309568
;2017-02-09 00:04;0;1;"to be real honest, I am no longer sure if I am actually an ENTP , INFJ, or INTJ. Which makes no sense because they are totally diff I know";;;;"829601904900452353";https://twitter.com/vie_eros/status/829601904900452353
;2017-02-08 12:40;0;3;"I have an ENTP personally so did Alfred Hitchcock which is why I am meant to be in my industry";;;;"829429755204272128";https://twitter.com/trySarah__tops/status/829429755204272128
;2017-01-30 07:03;0;1;"uhm i am an ENTP i wonder what yoongi is";;;;"826083476147470338";https://twitter.com/bychenle/status/826083476147470338
;2017-01-29 21:34;1;5;"i am rly offended when ppl try and tell me victor isnt an entp ................";;;;"825940346974527491";https://twitter.com/trainingskates/status/825940346974527491
;2017-01-28 11:58;0;1;"@tru_north4 I am an ENTP . It's like being in a mixed marriage.";;@tru_north4;;"825432896823554048";https://twitter.com/Stu_9/status/825432896823554048
;2017-01-28 11:32;1;1;"I am an ENTP ... #irl pic.twitter.com/VWttTM2Pys";;;#irl;"825426411313909760";https://twitter.com/54v33n/status/825426411313909760
;2017-01-25 04:01;0;1;"So I had to Google this and it's hilarious how much of an ENTP I am";;;;"824225736252882944";https://twitter.com/madsthetic/status/824225736252882944
;2017-01-21 05:34;0;0;"I am excited to be a part of the @Evalueserve_USA team, started this past week. Huge fan of MBTI as well, I am an ENTP .";;@Evalueserve_USA;;"822799553573384192";https://twitter.com/mcnuttinsights/status/822799553573384192
;2017-01-14 01:04;0;0;"lsdkjfds i am an entp also and i was yelling at every part of it";;;;"820194966026665984";https://twitter.com/taeharem/status/820194966026665984
;2017-01-08 08:32;0;0;"i am an entp but got enfp as result once too, changing between feeling and thinking. what's p/j for?";;;;"818133191022284801";https://twitter.com/lesbhcnest/status/818133191022284801
;2017-01-07 20:51;0;1;"whatever i guess i am an intp but i still think im also an entp";;;;"817956804143566853";https://twitter.com/mazeoflilies/status/817956804143566853
;2017-01-07 14:10;0;6;"i got entp this time which is fake because i am an idiot";;;;"817856077555322880";https://twitter.com/remade57863696/status/817856077555322880
;2017-01-06 10:53;0;0;"Now idk if I'm an INTJ, ENTP , ISTP, ISTJ, INTP, ENFP, ESTJ, ISFP, idk who the fuck I am";;;;"817443950038568965";https://twitter.com/bedlintongt/status/817443950038568965
;2017-01-05 19:05;0;0;"believe it or not I am also an ENTP . But I just live for the intentionally difficult standardized patients";;;;"817205542724792320";https://twitter.com/relatableafmd/status/817205542724792320
;2017-01-03 21:51;0;1;"after several years of research i have finally come to the conclusion that I am an ENTP";;;;"816522493808746498";https://twitter.com/eckangaroo/status/816522493808746498
;2017-01-03 17:59;0;1;"Agree with this... at least it rings true with the infps ive met! I am an ENTP btw... :) i take it u are an mbti enthusiast?";;;;"816463925218869248";https://twitter.com/NiCrawler69/status/816463925218869248
;2016-12-30 01:11;0;0;"I am an ENTP "Debater." Haha. I'm going to say YES. http:// fb.me/8rhh343Eg";;;;"814760818352865280";https://twitter.com/CharMillington/status/814760818352865280
;2016-12-29 17:09;0;0;"as an entp and a scorpio, I am personally offended";;;;"814639559044542464";https://twitter.com/finalvalIey/status/814639559044542464
;2016-12-27 18:20;0;0;"I am learning about enneagrams. I am an ENTP (J), melancholy/choleric, but I'm not that familiar with these.";;;;"813932707138912256";https://twitter.com/StuffofHeaven/status/813932707138912256
;2016-12-21 14:57;0;1;"according to your experience I am an ENTP then. Which makes sense as I am clumsy AF lol";;;;"811707207297486848";https://twitter.com/CogFun/status/811707207297486848
;2016-12-19 17:14;0;2;"I am an #INFJ and the narrator in my novel is an ENTP . #ENTPs have amazing souls to match their amazing minds.";;;#INFJ #ENTPs;"811017013091045377";https://twitter.com/MilkNTuring/status/811017013091045377
;2016-12-16 22:41;0;0;"Ha I am an entp http:// fb.me/5m6u0Nw81";;;;"810012120045801472";https://twitter.com/michellemadhok/status/810012120045801472
;2016-12-13 00:20;0;1;"trying to tell me I am an #INFP ? Get in line of the people trying to convince me I am an #ENTP . :')";;;#INFP #ENTP;"808587440915095552";https://twitter.com/FarikoBrainiac/status/808587440915095552
;2016-12-11 13:27;0;1;"As all the other mbti quizzes that I've taken, this too points to the fact that I am an ENTP";;;;"808060574479302656";https://twitter.com/maritina_mela/status/808060574479302656
;2016-12-02 16:57;0;8;"This just in: I am now an ENTP instead of an ENFP. I am a mature and assertive logical queen who will put you in your place with the FACTS";;;;"804852009614643200";https://twitter.com/feliciaphil/status/804852009614643200
;2016-12-02 08:10;1;7;". @emmhimes Ending 2016 with self-reflection of course. Today, I am an ENTP . Just like the leaves, I keep changing.";;@emmhimes;;"804719274870849536";https://twitter.com/emmhimes/status/804719274870849536
