username;date;retweets;favorites;text;geo;mentions;hashtags;id;permalink
;2009-03-24 12:43;0;0;"@MarketingProfs one blog has me an INTJ ( I am SO not one of those); the other as ESTP - in real life I'm an ENTP or ENTF. I'm just sayin'...";;@MarketingProfs;;"1383595151";https://twitter.com/ruthseeley/status/1383595151
;2009-01-29 12:13;0;0;"I AM AN ESTP ... what are you?";;;;"1159533025";https://twitter.com/omytodd/status/1159533025
;2008-12-16 09:23;0;0;"@cuevash I did it too and mine was ISTP. I am always an ESTP . I don't think I am an I but the rest was right on.";;@cuevash;;"1060999251";https://twitter.com/capohanka/status/1060999251
;2008-12-01 08:19;0;0;"@CBJason I am an ESTP (Doer) http://tinyurl.com/5k2op7";;@CBJason;;"1032485898";https://twitter.com/aj_wood/status/1032485898
;2008-11-30 00:52;0;0;"@life_enthusiast My blog is also classed as as an ESTP blog, although I am actually an ENFJ. I can see why it would say that, though.";;@life_enthusiast;;"1030506480";https://twitter.com/ekverstania/status/1030506480
;2008-11-20 13:37;0;0;"interesting, blueorchidblog.com is ESFP & thesmartplanner.com is ESTP . I am personally an ISFP, but borderline J, on the myersbriggs tests.";;;;"1015427988";https://twitter.com/thinksplendid/status/1015427988
;2008-11-20 08:41;0;0;"I am being Myers Brigged....am an ESTP apparently. Tips, counselling and advice required.";;;;"1014957919";https://twitter.com/DavidBrain/status/1014957919
;2008-09-23 10:04;0;0;"@vsr i am an estp as well......";;@vsr;;"931901044";https://twitter.com/soumna/status/931901044
;2008-07-01 13:32;0;0;"I am an ESTP "Promoter", which means I'd make a good con man! http://www.personalitytest.net/types/descriptions/index.htm";;;;"847911473";https://twitter.com/Jmartens/status/847911473
;2008-04-24 03:12;0;0;""Where an ESTP sees ideas as the pawn of reality, an INTJ sees reality as the pawn of ideas." Woo Hoo! I love myself. I am vain I know.";;;;"795822979";https://twitter.com/vimoh/status/795822979