username;date;retweets;favorites;text;geo;mentions;hashtags;id;permalink
;2017-06-14 01:42;0;0;"listen hes fake okay. me as an intp kno this cos i am too";;;;"874909797912633344";https://twitter.com/disgusteddotmp4/status/874909797912633344
;2017-06-13 23:25;0;1;"I guess that's true lmao I am too...typed to see him in that way? but I think im petty as well bc im an INTP and I don't see jin";;;;"874875543967105025";https://twitter.com/amberliuve/status/874875543967105025
;2017-06-13 20:22;0;0;"damn the accuracy of that to me I guess I am an INTP after all haha";;;;"874829443268616192";https://twitter.com/vousfinissezici/status/874829443268616192
;2017-06-13 17:14;0;0;"http:// 9types.com/another personality quiz for those that them. I am a thinker/reformer with little helper/peacemaker...still an INTP";;;;"874782042776645633";https://twitter.com/TerriPeacock3/status/874782042776645633
;2017-06-13 16:04;0;1;"Last time i checked i think i was an intj. The first time i was intp . I wonder what i am now lol";;;;"874764335934877696";https://twitter.com/PocketPrism/status/874764335934877696
;2017-06-13 14:17;0;1;"FTR, I am an equal INTP /INTJ split";;;;"874737416640352257";https://twitter.com/Ishtisaur/status/874737416640352257
;2017-06-11 08:48;0;0;"Haha I am also an INTP , I am so awkward at telling jokes that I don't even try anymore, I love Jin even more now lol";;;;"873929931935424513";https://twitter.com/23_jumi/status/873929931935424513
;2017-06-11 06:02;0;0;"Personalities change. I have changed. From ESFP to INTP . I got tired being Marilyn Monroe. Burn-out. But I am not an Einstein, I guess #EGO";;;#EGO;"873888224308903936";https://twitter.com/theredcypress/status/873888224308903936
;2017-06-11 05:06;0;0;"just re-did the test, i am currently an intp ! lmao";;;;"873874111629492225";https://twitter.com/cyprhers/status/873874111629492225
;2017-06-11 02:21;0;0;"for instance I am an INTP (TiNe), but when I am angry I actually default to SeFi reactions, which could make ppl see me as a shitty ESFP";;;;"873832578326945794";https://twitter.com/judgehangman/status/873832578326945794
;2017-06-10 23:09;0;0;"omg .. an intp .. i .. am Seokjin https:// twitter.com/ctrIbeat/statu s/873771983900622850 …";;;;"873784327477239808";https://twitter.com/taeberri/status/873784327477239808
;2017-06-10 22:59;0;0;"I bet the search rate for MBTI test skyrockets after bangtan posted their result I am an INTP btw :3";;;;"873781599912906752";https://twitter.com/grapemintree/status/873781599912906752
;2017-06-10 22:39;1;10;"Fuck. I did some reading. If this is in any way accurate, then I am definitely an INTJ, not an INTP . Oh, well. http:// personalityjunkie.com/08/intj-vs-int p-type-differences/ …";;;;"873776590752239616";https://twitter.com/JoParkerBear/status/873776590752239616
;2017-06-10 22:28;0;15;"HAHA. Success! His knock-off seems way less legit, but it says I am an INTP . I will take it for now. I WILL be an E one day.";;;;"873773931198599168";https://twitter.com/JoParkerBear/status/873773931198599168
;2017-06-10 22:18;0;0;"I am an INTP https:// twitter.com/taeforguk/stat us/873770432234536961 …";;;;"873771302053699584";https://twitter.com/taecafe_/status/873771302053699584
;2017-06-10 21:43;1;3;"ACCORDING TO AN ONLINE TEST, JIN & KAT WHO ARE INTP , ARE COMPATIBLE WITH ENFJ (ME). I am pleased.";;;;"873762688320589824";https://twitter.com/erojins/status/873762688320589824
;2017-06-10 21:28;0;0;"I AM SO SURPRISED THAT JIN IS AN INTP ??????!!???! pic.twitter.com/uo9hKFJqqP";;;;"873758903988662274";https://twitter.com/cheelchan/status/873758903988662274
;2017-06-10 21:27;0;0;"seokjin is an intp ?? shit i am too";;;;"873758469412671488";https://twitter.com/peachyhues/status/873758469412671488
;2017-06-08 22:47;0;2;"An INTP watches and thinks to themselves " I am so intelligent and different than everyone"";;;;"873053874386460677";https://twitter.com/KILLCZOP/status/873053874386460677
;2017-06-05 07:38;0;0;"i just took the mbti test again twice and instead of an intp i am apparently entp now";;;;"871738071825264643";https://twitter.com/lovechaehw/status/871738071825264643
;2017-06-04 02:26;0;0;"8. I am either an INTP or INTJ... the last letter changes depending on what test I'm taking";;;;"871297101501579265";https://twitter.com/krpclara/status/871297101501579265
;2017-06-04 01:52;0;0;"Just for the hell of it, I just finished doing a personality test and the result was that I am an INTP ( logician). Reading the detailed -->";;;;"871288539740340225";https://twitter.com/GrandpaMcJimbo/status/871288539740340225
;2017-06-03 09:23;0;0;"YeP but it was a really long time ago idk if i am still an intp";;;;"871039706397646848";https://twitter.com/BatWithBenefits/status/871039706397646848
;2017-06-03 08:03;0;1;"Well I am not particularly attracted to his appearance. I admire his intelligence. Plus he's an INTP like me!! That's a bonus right there";;;;"871019571553083392";https://twitter.com/imanrmzi/status/871019571553083392
;2017-06-01 22:07;0;1;"5. I am an INTP";;;;"870507024252936192";https://twitter.com/_okamotoo/status/870507024252936192
;2017-06-01 10:54;0;0;"11. I am an INTP personality. Which idk exactly what it all means but every time I'm tested it's the same result: http://www. 16personalities.com/intp-personali ty …";;;;"870337674418286592";https://twitter.com/Haiydan/status/870337674418286592
;2017-06-01 07:59;0;0;"Apparently I am an INTP which is cool af";;;;"870293611090505728";https://twitter.com/afiisbored/status/870293611090505728
;2017-05-31 11:35;0;0;"Could be pinpoint this to childhood? He had a strict father and bullied I am guessing his mother is the sole reason he didnt turn to an INTP";;;;"869985578397388802";https://twitter.com/katavasis/status/869985578397388802
;2017-05-30 21:59;0;1;"I am as well. " I am the common denominator and independent variable" is a good inner-mantra. I am now an ENTP, I used to be an INTP .";;;;"869780324431142914";https://twitter.com/AaronRZiegler/status/869780324431142914
;2017-05-30 12:37;0;1;"Ikr specially if he/she is an intx-a like sooo much fitting. Urg. Btw my one is INTP . More INTP than i am , lol";;;;"869638824208592897";https://twitter.com/MayaDaher10/status/869638824208592897
;2017-05-30 04:40;0;0;"I AM AN INTP . It's actually crazy that you just said this bc I JUST took the treat and got infp for the first time ever";;;;"869518898911092736";https://twitter.com/sleepyIisa/status/869518898911092736
;2017-05-26 17:27;0;1;"I wonder which type I am . But I'll guess ENTP or ENTJ, although I wish I was a INTP but there's no way I'm an "I" http:// observer.com/2017/05/what-k ind-of-traveler-myers-briggs-personality-type/ …";;;;"868262380467343361";https://twitter.com/equanimitii/status/868262380467343361
;2017-05-25 22:24;0;4;"omfg it just occurred to me ... i am an unbearable know-it-all #intp";;;#intp;"867974788790145024";https://twitter.com/feralandfancy/status/867974788790145024
;2017-05-22 23:34;0;0;"I still sometimes wonder if I am an intp or just keep mistyping :0 mostly because people always question me when I say I'm an intp , lol";;;;"866905092418490370";https://twitter.com/TheLastPunicorn/status/866905092418490370
;2017-05-22 12:46;0;7;"I am an INTP , and I don't believe I ever met another until I started at MSFT...then was surrounded by them. A revelation, really.";;;;"866742120652062720";https://twitter.com/CarmenCrincoli/status/866742120652062720
;2017-05-21 08:53;0;0;"I'm private, imaginative, logical, and laid-back. In other words I am an INTP . To be specific INTP-A.";;;;"866321052850192384";https://twitter.com/_hwangeummaknae/status/866321052850192384
;2017-05-20 11:28;0;0;"So i am an INTP Basically uber nerd/geek that cant take care of himself and only feeds on conflict and new information and internet and deb8";;;;"865997774562574337";https://twitter.com/walalangbored/status/865997774562574337
;2017-05-20 08:38;0;2;"I'm probably being too forward here, but . . . hey, #INFJ ladies, I am an #INTP male! #introvert https:// introvertdear.com/news/infj-intp -highly-compatible/ …";;;#INFJ #INTP #introvert;"865954956511195136";https://twitter.com/JimbauxsJournal/status/865954956511195136
;2017-05-18 19:51;1;0;"I am voting for BTS for TOP SOCIAL ARTIST at the #BBMAs . RT to vote! #BTSBBMAs I always get typed as intp but I think I might be an entp";;;#BBMAs #BTSBBMAs;"865399598298300416";https://twitter.com/GBhadal/status/865399598298300416
;2017-05-18 13:15;0;0;"i think sherlock is NOT an intp because i am and i wish i'd be as cool as him";;;;"865299845434810370";https://twitter.com/fIuffysehun/status/865299845434810370
;2017-05-18 07:10;0;0;"Based on the quotes (I think, therefore I am .") I guessdat Descartes is an INTP tho";;;;"865208093713416192";https://twitter.com/xatanice/status/865208093713416192
;2017-05-17 23:22;0;0;"i've upgraded from an intp to an entj and i think that says a lot on how i am still a type a no matter what";;;;"865090279853903872";https://twitter.com/okayevm/status/865090279853903872
;2017-05-12 14:14;0;0;"2/3 personality test said I am an INTP and the other 1/3 i am an INFJ lol";;;;"863140442589675521";https://twitter.com/hannahdeuls/status/863140442589675521
;2017-05-10 09:07;0;0;"I am an intp";;;;"862338281392025601";https://twitter.com/thelilmermaid30/status/862338281392025601
;2017-05-08 13:52;0;0;"Apparently I forgot my personality type and thought I was an INFJ but the truth is I am an INTP fuck.";;;;"861685148806389760";https://twitter.com/hannahdeuls/status/861685148806389760
;2017-05-05 13:38;0;1;"I AM AN INTP BUT WHY AM I NOT A GENIUS https:// twitter.com/MarshallTanaka /status/859809630821556224 …";;;;"860594694572482560";https://twitter.com/annaswift13/status/860594694572482560
;2017-05-05 02:09;0;0;"Last time I took a Myers-Briggs test I was INTP . I am now an ESFP. That's a pretty big difference.";;;;"860421167957540865";https://twitter.com/Invo347/status/860421167957540865
;2017-05-04 11:43;1;5;"I am an INTP and have audio and visual hypersensitivity together with olfactory, tactile and taste hyposensitivity.";;;;"860203259138650112";https://twitter.com/_mutereddit_/status/860203259138650112
;2017-05-04 08:36;0;5;"Right. When I first learned I was INTP I pretended I was *so* logical & not an emotional bag of bones (hint: I am an emotional bag of bones)";;;;"860156156131627008";https://twitter.com/intpclaire/status/860156156131627008
;2017-05-03 10:27;0;3;"When I first learned MBTI,I read the descriptions first but didn't take the test. I was like. I AM AN INFP! Then I read INTP ...oh that's me";;;;"859821821918453760";https://twitter.com/MarshallTanaka/status/859821821918453760
;2017-05-02 00:32;0;0;""If I Am An INTP Can I Do Sales?" https://www. linkedin.com/pulse/i-am-int p-can-do-sales-joshua-dan … #salesmanagement #sales";;;#salesmanagement #sales;"859309635987054593";https://twitter.com/dolocaldigital/status/859309635987054593
;2017-05-02 00:32;0;0;""If I Am An INTP Can I Do Sales?" https://www. linkedin.com/pulse/i-am-int p-can-do-sales-joshua-dan … #salesmanagement #sales";;;#salesmanagement #sales;"859309530177470464";https://twitter.com/nadeemansary/status/859309530177470464
;2017-05-02 00:29;17;13;""If I Am An INTP Can I Do Sales?" https://www. linkedin.com/pulse/i-am-int p-can-do-sales-joshua-dan … #salesmanagement #sales";;;#salesmanagement #sales;"859308757616136192";https://twitter.com/jose_garde/status/859308757616136192
;2017-05-01 19:43;0;1;"But, mostly I end up INTP , and yes, I am an engineer. And talking is way overrated.";;;;"859236871834030080";https://twitter.com/HayiWena/status/859236871834030080
;2017-05-01 11:18;0;5;"Your majesty! I am in awe of your talent, and very inspired by it. And you're just an awesome human being that I'm so grateful to know.";;;;"859109759823347715";https://twitter.com/Piccadillyxo/status/859109759823347715
;2017-05-01 06:14;0;0;"https://www. 16personalities.com/free-personali ty-test … Been taking similar personality tests multiple times now and I am , indeed, an INTP xD No more doubts about it!";;;;"859033251905626113";https://twitter.com/RepaerNeimad/status/859033251905626113
;2017-04-30 17:34;0;2;"I often wonder if I am an intp but then I remember I'm just becoming an adult--I think we all become a little less social as we age haha";;;;"858842054939467776";https://twitter.com/ashleyphylicia/status/858842054939467776
;2017-04-30 03:27;0;0;"According to the Myers-Briggs Type Indicator, I am either an INTP , an INTJ or an INFP. (1/2)";;;;"858628963836583937";https://twitter.com/cynic1970/status/858628963836583937
;2017-04-28 09:19;0;0;"Even if I'm an INTP , I still have feelings, it's just that I am rarely aware with how others feel. It happened to me a couple of times.";;;;"857992653136318464";https://twitter.com/annaswift13/status/857992653136318464
;2017-04-27 16:36;2;5;"It took me a very long time to realize people are less careful with words than I am .";;;;"857740385715728386";https://twitter.com/belatedINTP/status/857740385715728386
;2017-04-25 22:53;0;0;"As an INTP , I am made up of Titanium, Neon, Silicon, and Iron";;;;"857110356266815489";https://twitter.com/cosmickale/status/857110356266815489
;2017-04-24 18:52;0;0;"An INTP me be, and yet a happy librarian I am https:// twitter.com/wef/status/856 572966125137920 …";;;;"856687242580045824";https://twitter.com/mhohner/status/856687242580045824
;2017-04-22 07:54;0;1;"22.) I am an INTP , Introvertion Intuition Thinking Perceiving. It's really uncommon esp for females";;;;"855796846421323781";https://twitter.com/onleeuiwoong/status/855796846421323781
;2017-04-20 20:05;0;2;"great info thanks,maybe I am not an INTP";;;;"855256136718659585";https://twitter.com/TechProGeek/status/855256136718659585
;2017-04-20 15:59;0;0;"i am an intp and if u are a infj or infp turn on ur location i wanna figh t";;;;"855194173447827456";https://twitter.com/loveIynichole/status/855194173447827456
;2017-04-20 13:19;0;0;"i did this and it kept saying i'm an intp and i am Not. almost everything else was pretty accurate though";;;;"855154075905687552";https://twitter.com/lillywinns/status/855154075905687552
;2017-04-20 06:22;0;0;"What are you? I am an ENTP with burst of INTP on some tasks (old engineering days) #MBTI http:// intel.ly/2on1x4k";;;#MBTI;"855049090975113216";https://twitter.com/diegoalco/status/855049090975113216
;2017-04-20 03:54;0;1;"lrt real talk the INTJ description fit me literally better than anything I've ever seen but I am actually an INTP so now I'm confused";;;;"855011809614454786";https://twitter.com/Puppersparty/status/855011809614454786
;2017-04-19 10:08;0;0;"wow it turns out i am an INTP and no longer an INFP";;;;"854743397717946369";https://twitter.com/rosegoldally/status/854743397717946369
;2017-04-18 21:53;0;1;"in a surprising turn of events, i am evidently an INTP";;;;"854558553880887296";https://twitter.com/goodbye2thebeat/status/854558553880887296
;2017-04-17 11:14;0;0;"i was reading more about my personality, i am an intp by the way";;;;"854035386418421761";https://twitter.com/annaswift13/status/854035386418421761
;2017-04-16 20:19;1;1;"I'd like to announce that i am , what they call, an INTP . Pls refrain from speaking 2 me unless you are going 2 talk about magnetic flux.";;;;"853810145180217344";https://twitter.com/ayyyyejayyye/status/853810145180217344
;2017-04-12 20:32;2;9;"Bottom line: I am a really silly, moderately outgoing INTP , not an ENTP.";;;;"852363954475106304";https://twitter.com/intpclaire/status/852363954475106304
;2017-04-12 08:55;0;6;"So... I am an #INTP with a close #INTJ friend and #ENTJ brother. If I meet an #ENTP does that spell danger for world domination? #jest";;;#INTP #INTJ #ENTJ #ENTP #jest;"852188392620257280";https://twitter.com/belatedINTP/status/852188392620257280
;2017-04-05 10:28;0;0;"hey, i am an INTP too!!";;;;"849675226166067200";https://twitter.com/reiinennui/status/849675226166067200
;2017-04-02 09:34;0;0;"hence the resistance. Anyways I am an advocate of free will. But logic says if it ain't harmful, does good let it be imposition or freewill.";;;;"848574395748540421";https://twitter.com/INTP_Logic/status/848574395748540421
;2017-04-01 23:51;0;0;"I just thought way to hard about this, maybe I am an INTP";;;;"848427549986217984";https://twitter.com/pin0ygrigi0/status/848427549986217984
;2017-03-31 16:30;0;0;"And then, here i am , an INTP who could only struggle with our nonexistent feelings https:// twitter.com/munfess/status /847927009082736641 …";;;;"847954186519977985";https://twitter.com/Lluminarie/status/847954186519977985
;2017-03-30 18:38;0;2;"Well, I am an introvert ( INTP et al), but I don't think wife would like "Honey, could you please find something to do FIVE nights a week?"";;;;"847624018723168256";https://twitter.com/todmassa/status/847624018723168256
;2017-03-30 11:36;1;2;"@mlsterling11 I am an intp , but feel infp... :) xx @Elements4Beauty #veganmakeup #CrueltyFree #ecobeauty @bluebirdflyaway";;@mlsterling11 @Elements4Beauty @bluebirdflyaway;#veganmakeup #CrueltyFree #ecobeauty;"847517811152793601";https://twitter.com/Elements4Beauty/status/847517811152793601
;2017-03-30 10:46;0;2;"every single person on the internet: I Am an INFP/INTJ/ENTP/ INTP /INFJ";;;;"847505435691110400";https://twitter.com/halshogging/status/847505435691110400
;2017-03-29 01:24;0;0;"I am an INTP equal with Albert Einstein and @BillGates . Nice";;@BillGates;;"847001479370166275";https://twitter.com/keikokei0721/status/847001479370166275
;2017-03-28 08:20;0;0;"Max Loughan is a INTP . I am an ENTP. I hope Max Loughan accomplishes in free energy that which is the goal: zero-point energy";;;;"846743733068554241";https://twitter.com/AaronRZiegler/status/846743733068554241
;2017-03-25 22:58;0;0;"nope, I am an infj, but infj x intp relationships are called golden pair";;;;"845877606654365696";https://twitter.com/WlCKERJULlA/status/845877606654365696
;2017-03-24 22:58;0;0;"i keep forgetting what i am .. lmao am i an intj? Lolol or was i an intp";;;;"845515196521103361";https://twitter.com/dyoramine/status/845515196521103361
;2017-03-21 14:42;0;0;"I am an INTP for sure .";;;;"844303316641234944";https://twitter.com/_colecarroll/status/844303316641234944
;2017-03-20 08:32;0;1;"I am such an introvert. ( INTP ) I can't function at social events. https:// twitter.com/ineedafandom/s tatus/814319165406318596 …";;;;"843847723631738880";https://twitter.com/SpiritOfWit/status/843847723631738880
;2017-03-19 11:09;0;1;"urg not only him, i am an intp too like you, sfjs with their Si make me feel so much watched and under realistic control";;;;"843524950749315072";https://twitter.com/MayaDaher10/status/843524950749315072
;2017-03-18 14:31;1;0;"Just like that! I am an INTP on Myer Brigs, you must be a J? Or, is this your study?";;;;"843213383650480129";https://twitter.com/denisedurakpsyd/status/843213383650480129
;2017-03-17 13:56;0;3;"I am an INTP with like one emotion so to me it's like getting a REALLY STUPIDLY HARD puzzle";;;;"842842008951623683";https://twitter.com/SarahTolcser/status/842842008951623683
;2017-03-17 07:41;1;2;"I thought it stood for immortal. As an INTP , I am seriously disappointed";;;;"842747807488446464";https://twitter.com/dontCAREoline/status/842747807488446464
;2017-03-15 18:38;0;0;"When you seem some othet Malaysian says they are an intp I am like NO pic.twitter.com/0HncXnkgCD";;;;"842188322491535360";https://twitter.com/glittersocks27/status/842188322491535360
;2017-03-05 19:11;0;1;"ive changed so much since i last took an mbti test like i was intp and idk what i am now but ,, let's see";;;;"838587822982447104";https://twitter.com/boxofrainn/status/838587822982447104
;2017-03-05 10:03;0;0;"This 2006 webcomic had a shout-out to INTP Myers Briggs Personality types As an INTJ I am heavily saddened that the T-rex didn't shout at me";;;;"838449929878188038";https://twitter.com/polyphonetic/status/838449929878188038
;2017-03-02 15:47;1;2;"Hi. I'm an INTP and I don't know who the hell I am or what the hell I want to do. I've never known these things. Perpetually confused...";;;;"837449327354212354";https://twitter.com/SpiritOfWit/status/837449327354212354
;2017-03-02 06:34;1;2;"agree!!!! I am a volcano!! It's awful";;;;"837310119474049024";https://twitter.com/SarahEyre83/status/837310119474049024
;2017-02-26 02:01;0;0;"that doesn't make me a psychopath ! And I am an INTP that's why I said it right";;;;"835791814804267008";https://twitter.com/lona_j_/status/835791814804267008
;2017-02-22 11:23;0;1;"Slowly changing from an ENTP to an INTP and I am ok with it";;;;"834483792458887169";https://twitter.com/CaseSandberg/status/834483792458887169
;2017-02-21 17:58;0;0;"@curious_ intp Thanks Emily. I am INTP , u INTP . That = Friendship. I am old, an idea, can I adopt u? ha! kidding! LOL!";;@curious_;;"834220753365168128";https://twitter.com/Gwynplaine999/status/834220753365168128
;2017-02-21 11:21;0;0;"i redid the mbti test and i am an INTJ now????? i took it last year twice and i got intp on both, guess not much has changed";;;;"834120819278172160";https://twitter.com/d1uha/status/834120819278172160
;2017-02-14 15:32;0;1;"I have tested as an ISFP, INFP, INTP , and INXP! The 'X' says that I am right in the middle between Thinking and Feeling!";;;;"831647272727408643";https://twitter.com/GaryBro15122624/status/831647272727408643
;2017-02-11 13:29;0;1;"I am responding #1 this is great. Love both.#2 I am an INTP also. Kinda rare. So hi.";;;#1 #2;"830529252579823618";https://twitter.com/CeartasDoChach/status/830529252579823618
;2017-02-10 07:55;0;0;"seriously? Mike an #INTP introvert? He's an obvious Extrovert. If that needs explaining then I am speculating...";;;#INTP;"830082731619016705";https://twitter.com/FarikoBrainiac/status/830082731619016705
;2017-02-09 19:55;0;2;"I am also an INTP . Fits well. Yeah Myers-Briggs is prescriptively dumb but descriptively it's ok";;;;"829901483873296390";https://twitter.com/willlstratton/status/829901483873296390
;2017-02-09 13:10;0;0;"INTPs are the worst people. I say this because I am an INTP ,";;;;"829799550126813186";https://twitter.com/arlocado/status/829799550126813186
;2017-02-09 10:23;0;0;"The absolute best and most accurate list of amusing things about being an INTP . I am every last bit of this! http:// fb.me/3kiimBpyV";;;;"829757693535596544";https://twitter.com/PastyHen/status/829757693535596544
;2017-02-07 11:28;0;2;"pidge is an intp bc i am an intp";;;;"829049098426863617";https://twitter.com/ilovwendy_moved/status/829049098426863617
;2017-02-04 19:21;0;0;"good gods, i am really an intp .";;;;"828081030380744704";https://twitter.com/RHETORlKA/status/828081030380744704
;2017-02-03 13:46;0;1;"@rebeccatun That's an amazing coincidence, I am also INTP . We should get together and mostly ignore each other.";;@rebeccatun;;"827634406684762112";https://twitter.com/belf/status/827634406684762112
;2017-02-01 15:44;0;1;"I am an INTJ. But there are times I feel deeply & procrastinate. Does … by Rachel Green https://www. quora.com/I-am-an-INTJ-B ut-there-are-times-I-feel-deeply-and-other-times-when-I-tend-to-procrastinate-Does-this-mean-that-I-have-INFJ-and-INTP-tendencies/answer/Rachel-Green-92?srid=u5g5X … #INTJ #INFJ #INTP #mbti";;;#INTJ #INFJ #INTP #mbti;"826939198347161600";https://twitter.com/EI_to_work/status/826939198347161600
;2017-02-01 14:08;0;1;"NDJDJ like was he taking the personality test where he gets a letter@lersonalith like I am an INTP did he get smtjing like that";;@lersonalith;;"826915042155048960";https://twitter.com/californiarolls/status/826915042155048960
;2017-01-31 22:38;0;0;"thats it i am an intp . no doubt. i already take this test for many times since 2015 and im still an intp pic.twitter.com/FRKSUTn7ys";;;;"826681118678134784";https://twitter.com/gwimniw/status/826681118678134784
;2017-01-31 04:10;1;9;"I am an #INTP #ReasonsToLoveMeIn4Words";;;#INTP #ReasonsToLoveMeIn4Words;"826402284095549440";https://twitter.com/BradReason/status/826402284095549440
;2017-01-30 17:48;0;0;"Caution. I am an INTP . We work problems out through theoretical exploration and explanation. Thank you for not taking us seriously.";;;;"826245809494695936";https://twitter.com/NoraTwoSpirit/status/826245809494695936
;2017-01-30 03:36;0;0;"I am an intp";;;;"826031301346078721";https://twitter.com/Huda_PG/status/826031301346078721
;2017-01-28 11:49;0;0;"i am and always will be constantly switching between an INTJ and INTP";;;;"825430735716773888";https://twitter.com/thisbeatiscrack/status/825430735716773888
;2017-01-27 21:14;0;0;"... You guys are good... I AM an INTP https:// twitter.com/krpclara/statu s/824978555054362624 …";;;;"825210332310183937";https://twitter.com/krpclara/status/825210332310183937
;2017-01-26 16:40;0;3;"I am an INTP , so we are almost complete opposites @Fan_Of_TA ! haha Finding cool INTP characters was hard... pic.twitter.com/nKLu1JsfKJ";;@Fan_Of_TA;;"824779158349807617";https://twitter.com/hayan_goyangi/status/824779158349807617
;2017-01-25 01:57;0;1;"ftr i am an INTP and afaik my sister is an INTJ so for a variety of reasons we are all fortunate that i am the family fuckup";;;;"824194519558213633";https://twitter.com/the_stars_abide/status/824194519558213633
;2017-01-20 17:54;7;15;"a month as an infp: week 1: i might be an infj week 2: no i am an intp week 3: INFP forever repeat #INFP #Issues";;;#INFP #Issues;"822623366368653313";https://twitter.com/JohnNeil394/status/822623366368653313
;2017-01-19 07:59;0;0;"I took the myers briggs test last year and I was an INFP but suddenly now I am INTP , what does this mean";;;;"822111129837113344";https://twitter.com/nocelineno/status/822111129837113344
;2017-01-17 19:56;0;1;"i am either an INFP or an INTP . The F/T are 50/50.";;;;"821566987335831552";https://twitter.com/hydragoseek/status/821566987335831552
