username;date;retweets;favorites;text;geo;mentions;hashtags;id;permalink
;2019-04-29 23:44;0;3;"so am i just an introverted entp or an extroverted intp i am confusion";;;;"1123115854051196928";https://twitter.com/PapemelroticPAT/status/1123115854051196928
;2019-04-28 20:39;1;0;"i wonder if Taehyun is an INTP , i am often intimidated by that personality type skksks";;;;"1122706881934430208";https://twitter.com/thisisfortxt/status/1122706881934430208
;2019-04-28 11:53;0;1;"Hmmm. I am an INTP . I never much cared what people think of me except for a select few. http://www. humanmetrics.com/cgi-win/jtypes 2.asp …";;;;"1122574578851565568";https://twitter.com/SBelleSpitfire/status/1122574578851565568
;2019-04-26 16:13;0;2;"1. Intelligence is rare, maybe even scarce. 2. Hawkeye pierce 3. I’m an INTP , a resident of the abstract plane, the “world of forms” 4. In nearly all facets, I am strange and different than the norm. To the point of feeling alien. 5. @_FloridaMan and @GrimReaperInc";;@_FloridaMan @GrimReaperInc;;"1121915125710106627";https://twitter.com/Oracle0708/status/1121915125710106627
;2019-04-26 14:53;0;1;"I am also an INTP .... love that for us";;;;"1121895091226935297";https://twitter.com/lanaandemerson/status/1121895091226935297
;2019-04-26 14:21;0;0;"my mbti says intp which means that im an introvert but i never feel like i am an introvert :/ https:// twitter.com/panickedjae/st atus/1121886607219408897 …";;;;"1121886972274831360";https://twitter.com/panickedjae/status/1121886972274831360
;2019-04-26 04:35;0;1;"I am an intp your complete opposite";;;;"1121739646105296896";https://twitter.com/cacacapop/status/1121739646105296896
;2019-04-24 00:20;0;2;"Mutual: "I´m infp" Me: "OMG I´m almost the same! I´m intp " Mutual: "Wow...you must be so fucking smart" BITCH HAHAA I´M LITERALLY NOT. Idk why I am an intp when I´M A DUMBASS";;;;"1120950549569069056";https://twitter.com/PantaBoi/status/1120950549569069056
;2019-04-23 06:14;0;0;"5. what’s your mbti and zodiac sign ? — oof i’m a whore for those two subjects. i’m an aries and an INTP (yeah that sums up pretty well how fucked up i am skdjs)";;;;"1120677317200814081";https://twitter.com/soukokump3/status/1120677317200814081
;2019-04-23 05:44;0;0;"I am having a sweet and awesome dream that an ambidextrous INTP jet setter, holding a zircon-encrusted blouse, sings softly to an attentive but powerful flaxen chestnut, with black points, Danube Delta horse.";;;;"1120669865902317568";https://twitter.com/MBTIhorsewomen/status/1120669865902317568
;2019-04-23 05:09;0;0;"Being an INTP , that is not surprising. The barriers I am referring to are those that will affect you negatively and unnecessarily. When all they see is your condition, they stop seeing you as a person. It is more difficult to deal with people when they do that.";;;;"1120660848266158082";https://twitter.com/umbranoid/status/1120660848266158082
;2019-04-21 21:16;0;0;"This is one of the many things that was horrible about my childhood. (Not the worse thing mind you, but it was frustrating.) My father is an ESTJ Grandmother is an ESFJ I am an INTJ (Socionics' ILI / INTp ) As soon as I "added" to something those other people did not see it as";;;;"1120179444684029953";https://twitter.com/Roland00Address/status/1120179444684029953
;2019-04-20 23:20;0;17;"As an INTP , the only thing I care about is following the truth wherever it leads me, which is why I am so often out of sync with these guys https:// twitter.com/ScottSurvival/ status/1119847655725838341 …";;;;"1119848298968432640";https://twitter.com/CptBlackPill/status/1119848298968432640
;2019-04-20 15:35;0;0;"@KonekoKittenYT yo u an INFP????i love Infp's! I am an INTP ! Any words to me??";;@KonekoKittenYT;;"1119731435089346566";https://twitter.com/ArsaMateRBLX/status/1119731435089346566
;2019-04-19 23:35;0;1;"Maturity is cool. Although, how do you adjust for them? As for me, an INTP , well ... as quiet and boring-looking as I am , I really am crazy, and that side can only be seen by my friends. I don't really express it to normal humans. So, "may contain nuts" is pretty accurate.";;;;"1119489680750235648";https://twitter.com/theINTJnovelist/status/1119489680750235648
;2019-04-19 19:05;0;0;"My name is Aaron and I am an INTP . Introduction | Logician Personality https://www. 16personalities.com/intp-personali ty … #16Personalities via @16Personalities";;@16Personalities;#16Personalities;"1119421874772086784";https://twitter.com/AaronGuetzlaff/status/1119421874772086784
;2019-04-19 18:46;0;0;"I’ve decided that intps are the worst out of the mbti types because I am an intp";;;;"1119416998562189312";https://twitter.com/wheniwasalien/status/1119416998562189312
;2019-04-18 07:45;0;0;"Well I am an intp ... pic.twitter.com/p0gduVdpu4";;;;"1118888230785564673";https://twitter.com/Trysin7/status/1118888230785564673
;2019-04-17 22:05;0;4;"I think I'm an ENTP. Keep in mind, ENTPs are the most introverted of the Extraverts, so it may seem like I am an INTP . #ENTP https://www. youtube.com/watch?v=j4YlA3 aZYJQ …";;;#ENTP;"1118742421372669952";https://twitter.com/TheCalebSteele/status/1118742421372669952
;2019-04-17 20:41;0;0;"I am analysing..... is ranpo an intj or intp I'm doubt";;;;"1118721107148906497";https://twitter.com/kanbanwaru/status/1118721107148906497
;2019-04-17 13:51;0;0;"NO I AM LMAO I WAS BRAGGING HAHAHA he’s an INTP";;;;"1118618050683498496";https://twitter.com/BiiFieri/status/1118618050683498496
;2019-04-16 16:53;0;7;"incase anyones wondering why i am how i am its probably cuz i am a scorpio sun and gemini moon (the two least favorite signs) and im also an INTP on the myers briggs scale (which is basically just a dorky loner). god did me so dirty I never asked for this pic.twitter.com/gTYZ6O9fAA";;;;"1118301322137280512";https://twitter.com/highitsme_/status/1118301322137280512
;2019-04-15 12:44;0;3;"Thanks. It's the product of what I'm reading, but more importantly an epiphany I came to just two weeks ago. I'm super sensitive to emotions. I tested and identified as an INTP , but nope, INFP. I used my thinking to distance myself from my feelings, but now I realize who I am .";;;;"1117876296418119680";https://twitter.com/JohnHere2Evolve/status/1117876296418119680
;2019-04-14 13:24;0;6;"I am an INTP . I used to think I was an INTJ since I had taken the Myers-Briggs test in high school and rushed it and got INTJ, but I taken it recently and it totally makes sense that I'm an INTP .";;;;"1117524121838071808";https://twitter.com/denialt23/status/1117524121838071808
;2019-04-13 21:44;0;0;"I am having a sweet and dazzling dream that an ardently passionate INTP woman, throwing aside her metal-studded black leather fringe jacket, gradually transforming her understanding of a placid charcoal grey Norwegian Fjord Horse.";;;;"1117287552602529792";https://twitter.com/MBTIhorsewomen/status/1117287552602529792
;2019-04-13 20:14;0;0;"n e ways, i took three bcoz im not rly convinced that i am an intp ? they're too logical for my one brain cell";;;;"1117264713635602432";https://twitter.com/yougotnowaengs/status/1117264713635602432
;2019-04-13 11:27;0;1;"It helps me to cope with my schedule. I find that now i am acting exactly like an intp with occasuonal spurts of Fe trying to come back. My Si has been less bothersome to me even though i usually hate Si with a passion.";;;;"1117132301564030977";https://twitter.com/LoreAdept/status/1117132301564030977
;2019-04-13 00:24;0;1;"yeonjun is an ENTP.... i am an INTP .......... this soulmateism..";;;;"1116965314606972929";https://twitter.com/yeonjunize/status/1116965314606972929
;2019-04-12 13:32;0;4;"My personality type is an Intp that’s part my issue. I am introverted . Maybe you are as well. Did u ever take your personality test? I took one on personality hacks and 16 personalities. It taught me a lot about myself.";;;;"1116801245686194176";https://twitter.com/Styles70408617/status/1116801245686194176
;2019-04-12 12:04;0;0;"Yes, MBTI confirmed I am an INTP after a former girlfriend said the same, and when I read the description it was basically me written on the webpage.";;;;"1116779068278616066";https://twitter.com/penfold_43/status/1116779068278616066
;2019-04-12 11:36;0;1;"I’ve never tested as an INTP , but 16 personalities now thinks I am one.";;;;"1116772039883280387";https://twitter.com/metafabulous/status/1116772039883280387
;2019-04-11 14:30;0;1;"Technically, I *am * glad to be an INTP . Still unfollowing. >.>";;;;"1116453428841066498";https://twitter.com/infranscia/status/1116453428841066498
;2019-04-10 12:31;0;2;"This is the risk of the internet confusing cognitive functions w/ personality :). (For instance, I am an INTP , yet bathe regularly ) . The MBTI is how your brain likes to take in and use info. Yes it can lead to SOME certain behaviors but it doesn’t have to. You do you";;;;"1116061266890711040";https://twitter.com/ACapableGenius/status/1116061266890711040
;2019-04-10 08:04;0;1;"Well you chose a box! I'm an INTJP According to their source materials, I am an INTJ but must be an INTP since I cannot be an INTJ Apparently, I can find fault/poke holes in stuff without even tryin'... Yeah...5w4, "Iconoclast" here";;;;"1115993865364889605";https://twitter.com/West221B/status/1115993865364889605
;2019-04-10 04:12;0;1;"I'm an INTP so I can be a bit more of a pain than I am currently available. Not bad, "than I intend" would be a worthy translation of that.";;;;"1115935656860106752";https://twitter.com/peanutsrevenge/status/1115935656860106752
;2019-04-08 22:31;0;0;"Can't agree, the future cannot be predicted using past metrics like that. Seems faulty logic. That said, does seem reasonable. We held so long @$6000, holding above would clearly be bull. My gut tells me we've been out of the bear for a while. I am an intuitive, INTP .";;@;;"1115487395728596992";https://twitter.com/omegaproxy/status/1115487395728596992
;2019-04-08 07:01;0;1;"I am an INTP so I always Nothing? Seriously? Which, in a weird way, makes sense. There's no always with me. Not many habits...";;;;"1115253369608622082";https://twitter.com/greekmistwizard/status/1115253369608622082
;2019-04-07 15:47;0;0;"I'm an INTP so I always thought I would love to be able to make it feel like I am a good fit for the job. https:// twitter.com/EsfGay/status/ 1114622488099590144 …";;;;"1115023295731179521";https://twitter.com/LetsGoCNote/status/1115023295731179521
;2019-04-06 21:43;0;1;"Damn I want to share this now with an INTP who is convinced I am an xNTP But locked account I will live, and that Airbender moment has already passed";;;;"1114750579081977861";https://twitter.com/Roland00Address/status/1114750579081977861
;2019-04-06 10:34;0;0;"Update I am now apparently INTP with E/I = 47/53 % we have moved from being a debater to a locigian. this changes nothing to me I’m still an ambivert";;;;"1114582124001222656";https://twitter.com/Aoki556/status/1114582124001222656
;2019-04-06 07:47;0;0;"I am an INTP . I would be great to write policy in your administration.";;;;"1114540194789650433";https://twitter.com/TZaminski/status/1114540194789650433
;2019-04-06 05:52;0;0;"My friends are and I am having a good time and want to participate in that moment with them, thats feeling too. One is introverted feeling, one is extroverted feeling. To look at an INTP (who uses Fe) and say I know he makes decision based on feelings he is no "thinker" the test";;;;"1114511130695745536";https://twitter.com/xtophersaurus/status/1114511130695745536
;2019-04-06 02:19;0;0;"I am an INTP -A Logician";;;;"1114457603818643456";https://twitter.com/MadabanMan/status/1114457603818643456
;2019-04-05 16:19;0;3;"I am an INTP , Cancer, Normie, fox player and that's why I need to get so close to the art";;;;"1114306600540475392";https://twitter.com/lawngarms/status/1114306600540475392
;2019-04-04 06:53;0;0;"I am an INTP - my personal ethos is truth in logic and reason... Though not prefect - I strive for it constantly...";;;;"1113801679063928832";https://twitter.com/JuenoMT/status/1113801679063928832
;2019-04-03 13:17;0;0;"I have lost track of the number of assholes I’ve had to deal with who proudly tell me, “I’m an INTJ/ISTJ/ INTP , we’re really rare in the population, we’re hard to deal with, this is just how I am ."";;;;"1113535896870039552";https://twitter.com/lschmeiser/status/1113535896870039552
;2019-04-03 12:14;0;0;"Super interesting. I am an INTP and it totally fits. The 16 Types of Fitness Personalities, According to Myers-Briggs https://www. livestrong.com/article/137169 92-myers-briggs-fitness-personalities/ …";;;;"1113520083136122881";https://twitter.com/T4r4Beth22/status/1113520083136122881
;2019-04-02 07:54;0;2;"I answered B, but only because I'm very liberal with my interpretation of "measured". I am an INTP Aquarius somewhere in the 110-120 IQ points range. My Chinese sign is the Horse. My skull has a slightly asymmetrical shape and there is a dent in its back. I fell on it as a child.";;;;"1113092301058867200";https://twitter.com/Lispegistus/status/1113092301058867200
;2019-04-01 04:30;0;0;"Enough about that. So , I am a ravenclaw, which is highkey obvious because I'm always gushing about my house and LISTEN ITS VERY UNDERAPPRECIATED K SOMEONE HAS TO. And my mbti personality type is INTP , aka the logician which makes sense bc sometimes i do act like an »";;;;"1112678550069338114";https://twitter.com/OHMYYFORCE/status/1112678550069338114
;2019-03-29 04:10;0;0;"so i am an INTP ? oh wow";;;;"1111586405392834560";https://twitter.com/0612525_/status/1111586405392834560
;2019-03-28 23:04;0;1;"I don't know, same, beats me whether it's gone out (But I am supposedly an intp and don't know what enneagram I would be)";;;;"1111509297819717632";https://twitter.com/savourtardis/status/1111509297819717632
;2019-03-27 15:17;0;0;"I mean for my MBTI (which i have taken 3 times and gotten the same result) I am an INTP so I’m not that surprised tbh. pic.twitter.com/OuiKOXEUoQ";;;;"1111029396377350144";https://twitter.com/neodiangelo/status/1111029396377350144
;2019-03-27 11:04;0;0;"Think about me. I am an INTP";;;;"1110965877757919232";https://twitter.com/ChibaRyuta/status/1110965877757919232
;2019-03-27 04:41;0;0;"i AM an intp and that's the that on that";;;;"1110869414575067136";https://twitter.com/chaotictzen/status/1110869414575067136
;2019-03-27 00:15;0;5;"Wonwoo is a true gamer and an INTP I am sorry I can't help but to let out a";;;;"1110802470861565952";https://twitter.com/violetpetale/status/1110802470861565952
;2019-03-26 06:40;0;0;"https:// twitter.com/deprexon/statu s/1110303812907077634?s=21 … cmon Juni you know i am an INTP and i hate being unoriginal,you can take a look at my feed,everything i do is Hotpepperice's orginal work.";;;;"1110537004037693441";https://twitter.com/Hotpepperice1/status/1110537004037693441
;2019-03-25 23:18;0;2;"according to a buzzfeed article, Dwight Schrute is an INTP and Jim Halpert is an ISFJ.........this means corin is Dwight and I am Jim wtf";;;;"1110425743605948419";https://twitter.com/knives__/status/1110425743605948419
;2019-03-25 19:09;0;0;"I am simply not included in the second smaller group. As an INTP ,being an outcast is my routine. Don't worry folks, I am no longer taking it personally.";;;;"1110363134957510657";https://twitter.com/crazykucing/status/1110363134957510657
;2019-03-25 06:41;0;0;"so what do identify as? i'd say intp , since it's on your profile, but you're not sure? i am not as strategic as an intj, i am a terrible procrastinator. and i was curious what you are if you're neither leader nor follower.";;;;"1110174949099163648";https://twitter.com/INTParent76/status/1110174949099163648
;2019-03-25 06:17;0;3;"People loves categories. Like Fore effect that used by astrology, fortune-teller, and guess some people personalities. The truth that human personalities are very complicated. MBTI is useful for one thing: Entertaiment I am an INTP in entertaiment mode https:// youtu.be/Q5pggDCnt5M";;;;"1110168782180401153";https://twitter.com/mohemr/status/1110168782180401153
;2019-03-24 15:05;0;0;"*Am* I an INTP , after all? Because that's kind of how I am in class, according to her depiction. The first time I took the test, I admit I did get INTP . Every single other time, though, as I've evolved as a person in tandem, I've gotten INTJ. https://www. youtube.com/watch?v=wnHLck gLlLc …";;;;"1109939222918635520";https://twitter.com/nortonsmind/status/1109939222918635520
;2019-03-23 22:26;0;1;"We humanas are becoming more as we go along. I am an INTP Scorpio. It is hard to be compassionate... good is hard; evil is easy. I feel differently... everything is personal. I forgive everything, yet forget nothing.";;;;"1109687941901635584";https://twitter.com/n_stiltner/status/1109687941901635584
;2019-03-23 19:48;0;0;"as an intp cancer ravenclaw i am naturally prone to mood swings and being a bitch sorry it’s just who i am there’s nothing i can do :/";;;;"1109648264620589056";https://twitter.com/GayCappuccino/status/1109648264620589056
;2019-03-22 21:51;0;1;"I also checked to see if my personality changed, alas, I am still an INTP .";;;;"1109316797801598976";https://twitter.com/iamallamalion/status/1109316797801598976
;2019-03-22 19:55;0;0;"Crap wait jin is an INTP wait I think I am too I";;;;"1109287411496947713";https://twitter.com/wwcutiejinnie/status/1109287411496947713
;2019-03-20 12:27;0;1;"(I remain, alas, irrevocably an INTP ; I am always going to want to jump in with a, "This conversation is unfair to whichever side is not currently being represented, as evidenced by my thirty-page manifesto.")";;;;"1108449990559653891";https://twitter.com/IrkedIndeed/status/1108449990559653891
;2019-03-20 02:31;0;1;"I am an INTP . So no. I do not worry about your problems. There are much more interesting ones in the world.";;;;"1108300060507332608";https://twitter.com/PromethiusI/status/1108300060507332608
;2019-03-19 18:12;0;0;"I am an INTP , but sometimes drift over to ENTP due to my job working in the educational sector :) https://www. 16personalities.com/intp-personali ty …";;;;"1108174562628390912";https://twitter.com/DanielGallagher/status/1108174562628390912
;2019-03-19 17:40;0;0;"okay. i am a libra and an intp . basically, i want peace and harmony, and being an introvert, i can't talk early in the morning. please let me collect my senses first.";;;;"1108166373052538880";https://twitter.com/lililiyabitch/status/1108166373052538880
;2019-03-16 14:30;0;1;"The pic made me forget for a sec. All joking aside I am an INTP . If there are any other personality type descriptors, I know bupkis about them.";;;;"1107031284507987969";https://twitter.com/JShadic/status/1107031284507987969
;2019-03-15 20:34;0;0;"My IQ only measures my ability to do IQ tests (which I’m very good at) but ignores the fact that I am horribly dumb in many other types of intelligence, such as musical, interpersonal, spatial or bodily-kinaesthetic...or maybe that’s just because I’m an INTP";;;;"1106760665736241152";https://twitter.com/DrHLShearer/status/1106760665736241152
;2019-03-15 17:06;0;0;"I am an enneagram 5w4, which apparently correlates with INTP . https:// thoughtcatalog.com/heidi-priebe/2 016/01/mbti-and-the-enneagram-2/8/ …";;;;"1106708392431763456";https://twitter.com/DeanAbbott/status/1106708392431763456
;2019-03-15 01:06;0;0;"As An INTP , I Am Affronted Because You Right";;;;"1106466705038102528";https://twitter.com/rationelle/status/1106466705038102528
;2019-03-14 16:42;0;0;"Haha yes people usually don't think I am one haha I am an INTP";;;;"1106339927476690945";https://twitter.com/Itslutfi/status/1106339927476690945
;2019-03-13 16:40;0;0;"I am really an INTP huh? Wksjhds";;;;"1105976855029473282";https://twitter.com/PyjamaBangtanie/status/1105976855029473282
;2019-03-12 13:42;0;0;"So you’re telling me JIN IS AN INTP ??!! I am an INTP and I was honestly expecting namjoon to be one, but Jin with his bubbly personality ? I would’ve never guessed tbh.";;;;"1105569806403751936";https://twitter.com/bangtanisluv__/status/1105569806403751936
;2019-03-11 18:01;0;0;"an intp (me) biasing another intp , seokjin, and our complete opposite, hoseok, an esfj ,,,,,,, i am a mess";;;;"1105272533593382912";https://twitter.com/jinhalexhale/status/1105272533593382912
;2019-03-11 17:52;0;0;"i am literally so stupid.... sorry i’m an intp ,,, this is so embarrassing";;;;"1105270406099943426";https://twitter.com/heejintendo/status/1105270406099943426
;2019-03-11 13:50;0;1;"i sometimes mistype as an e because i am very talkative, but mostly mistype as intp or enfp depending on how “good” i’m feeling. if my mental health is good, i’m more likely to mistype e, and if it’s bad, i mistype t";;;;"1105209472211959808";https://twitter.com/kayhihello/status/1105209472211959808
;2019-03-11 09:38;0;1;"as an intp , i see myself forced to theorize about the comeback, but as a dumbass, i am also confused by all of this";;;;"1105146080684109829";https://twitter.com/bomnaleaves/status/1105146080684109829
;2019-03-10 05:46;0;9;"Have you ever taken the Myers-Briggs personality type test based of Carl Jung’s work? I am an INTP . I spend a lot of time thinking. http://www. humanmetrics.com/cgi-win/jtypes 2.asp …";;;;"1104725187109347329";https://twitter.com/Shawn_B_CA/status/1104725187109347329
;2019-03-09 23:53;0;1;"so I might be an ENFP but I do not crave social interactions. I might be an ENTP but I am not ignorant of people's emotions in an argument. I might even be an ENTJ because myer briggs showed that result along with the first two. just tell me which mbti has yeehaw moments for INTP";;;;"1104651352045547520";https://twitter.com/taeoverflowers/status/1104651352045547520
;2019-03-05 06:58;0;2;"I am an INTP";;;;"1102946504141082624";https://twitter.com/WYidam/status/1102946504141082624
;2019-03-04 14:42;0;1;"I am an INTP . So I am rational to the core. I have read their lawsuits with the estate and I cannot understand why their stories on tv r different from those they told seeking money from jackson's estate. Why the stories keep changing, WHY?";;;;"1102700877406720000";https://twitter.com/DammasJames/status/1102700877406720000
;2019-03-04 00:49;0;0;"after extensive quiz-taking i have concluded that i am more of an intp goodbye now";;;;"1102491324450656256";https://twitter.com/datunknownhuman/status/1102491324450656256
;2019-03-02 09:10;0;0;"Not saying he isn't an INTP , but I am indeed getting some minor red flags (in terms of what could be inconsistency) because when I talk to @happysadlion, I can't help but zone in on Ti error and just tell her what that is.";;@happysadlion;;"1101892472349827072";https://twitter.com/belatedINTP/status/1101892472349827072
;2019-03-01 23:50;0;0;"Oh this is hysterical. Not. We own a very successful business. My husband is a night owl INTJ & works starting around noon. I am an INTP & start around 10. We are busy! That is what success means. We exercise when we can. Don’t change who you are to try to be successful.";;;;"1101751582784290817";https://twitter.com/SBelleSpitfire/status/1101751582784290817
;2019-02-27 08:51;0;7;"INTP . Getting into my own thoughts to the point that I am no longer noticing my surroundings. I have never been in an accident w/ myself driving but I’m terrified b/c of how close I’ve come multiple times due to this.";;;;"1100800644661821447";https://twitter.com/INTB94/status/1100800644661821447
;2019-02-26 10:47;0;0;"I am an outlier! INTP with Pisces sun, moon, venus and mercury. Thinking over Feeling isn’t typical of Pisces";;;;"1100467509482921984";https://twitter.com/killerkat37/status/1100467509482921984
;2019-02-26 09:50;0;1;"@CSJosephLife I'm reading your post on INTP and laughing (thanks for that). If I am an INTP , then INTPs really aren't that brilliant; I think it is a bit inflated; although I'm right about a lot of things, I've also learned recently that I'm stupid dumb about a whole lot of...";;@CSJosephLife;;"1100453029701136384";https://twitter.com/belatedINTP/status/1100453029701136384
;2019-02-25 19:28;0;4;"I am intp but can say had infp tendencies. Now, I am slight depressed seeing my how to train your dragons franchise comes to an end. Thinking about Hiccup's family and Toothless', ohhhh man, that's just so wonderful and melancholic at the same time.";;;;"1100236257974575104";https://twitter.com/AeonRiver/status/1100236257974575104
;2019-02-25 05:52;0;0;"10 Things That Excite the INTP Personality Type - As an INTP , this list summarizes me! It notes that an INTP reads 48 books per year - I am at 40 already! https:// buff.ly/2RW0wOu #INTP #MBTI #Personality pic.twitter.com/oCzE6y3Z04";;;#INTP #MBTI #Personality;"1100030657693143040";https://twitter.com/BenRogersWPG/status/1100030657693143040
;2019-02-24 22:51;0;0;"That's what I am ! Prosaic. Without being prolific. Once an INTP , now INTJ.";;;;"1099924710631137280";https://twitter.com/JimPivonka/status/1099924710631137280
;2019-02-24 16:26;0;2;"I still think Chidi is an INTP , but I am not 100% sure (people try to convince me he is an INFJ and they made good arguements) ... But he is definitely 6w5! The devil's advocate, but also his own daemon who can argue both sides of anything.";;;;"1099827981831139328";https://twitter.com/Roland00Address/status/1099827981831139328
;2019-02-22 23:07;0;1;"Hey I took this test too and, it gave me INTP but, I am an intj based on the humanmetrics and 16personalities but i get intp sometimes on 16 personalities. Lol, I guess we share the same "identity crisis"?";;;;"1099204079153078272";https://twitter.com/alamemaisip/status/1099204079153078272
