username;date;retweets;favorites;text;geo;mentions;hashtags;id;permalink
;2018-06-13 08:59;0;2;"True. I am an INFJ myself that's why I can tell Yoongi and Jungkook are the same. Tho sometimes Yoongi leans more on the INTP type. IKR?! They should do this one time. I would really like to know. @BigHitEnt @BTS_twt @bts_bighit Take notes!!!";;@BigHitEnt @BTS_twt @bts_bighit;;"1006928994267119616";https://twitter.com/taegikooky/status/1006928994267119616
;2018-06-12 19:05;0;2;"Wow. Feels like I am finding lost relatives. :) interesting connection among rh neg. Maybe Nordic alien? I read our blood is copper based, not iron. Too much iron causes auto Immune problems. I am an Intp on the Myers Briggs scale, also left handed. Heard we can't be cloned.";;;;"1006719067384840192";https://twitter.com/MikeinHalifax/status/1006719067384840192
;2018-06-12 02:52;0;1;"EXCUSE ME this is almost nat culture i like every group u names and i am a virgo and an intp THIS IS IDENTITY THEFT";;;;"1006474259676319747";https://twitter.com/lgbtzen/status/1006474259676319747
;2018-06-12 02:17;0;0;"Just a little thing I learned through my therapy: I am an INTP , and yes I have the straightforwardness & drive of an Aries. And that’s a conflict, you see. And contradictory by itself. With that things clash, and I am almost unable to cope because I really didn’t accept-";;;;"1006465610417463296";https://twitter.com/RandomHLM/status/1006465610417463296
;2018-06-11 11:25;0;1;"I am not saying anything, i am an INTP .";;;;"1006240918754689024";https://twitter.com/realteaplease/status/1006240918754689024
;2018-06-09 10:59;0;0;"I am a RM stan ( i am so unfaithful) and an INTP";;;;"1005509590891413504";https://twitter.com/AJscribblin/status/1005509590891413504
;2018-06-09 09:43;0;0;"I am having a sweet and fun dream that Gerðr, an exquisitely masterful audacious auburn and blue-eyed INTP baseball franchise heiress, throwing aside a midnight blue workshirt, smilingly crosses some terrific whitewater rapids on a visibly shaking palomino.";;;;"1005490557723074560";https://twitter.com/MBTIhorsewomen/status/1005490557723074560
;2018-06-07 21:21;0;1;"Aww i am an INTP";;;;"1004941388604198912";https://twitter.com/_noursharif_/status/1004941388604198912
;2018-06-07 12:32;0;0;"I also this this test and I am an INTP and it was sooooo accurate it changed my life";;;;"1004808450176684033";https://twitter.com/Mrassion/status/1004808450176684033
;2018-06-06 13:47;1;4;"For real I've been told I'm my evals that I am not sociable and don't share my life enough. I ask is there anything wrong w/my work & they always say no you're an exceptional worker. I tell them I'm an INTP & they can't make me share my life.";;;;"1004464785537331207";https://twitter.com/KayHarvey00/status/1004464785537331207
;2018-06-05 14:37;0;0;"Try fucking off you assuming bullshiting arsewipe of a torie, what are you an #ENFP @16Personalities I'm an #INTP comfortable fuck! You'd have me dead on this streets of this bullshite country! Comfortable I AM CANADIAN you want to step outside you Tory self professed sinner!";;@16Personalities;#ENFP #INTP;"1004114952200904707";https://twitter.com/TAD_KG/status/1004114952200904707
;2018-06-05 12:42;0;0;"I’ve known I am an INTP for a while now, but it’s crazy reading an in-depth analysis of who you are. It’s like someone dumped my brain into words and paragraphs. #INTP Logician Personality ( INTP , -A/-T) https://www. 16personalities.com/intp-personali ty … #16Personalities via @16Personalities pic.twitter.com/SvDbD0y4hp";;@16Personalities;#INTP #16Personalities;"1004085979945357313";https://twitter.com/ohdulcesss/status/1004085979945357313
;2018-06-04 08:50;0;0;"I liked a @YouTube video http:// youtu.be/hATWbo2e2RU?a So... Apparently I am not an INTP";;@YouTube;;"1003665368286720002";https://twitter.com/Roksonas/status/1003665368286720002
;2018-05-30 07:40;0;0;". @sama "Here’s what I like in a workspace: natural light, quiet, knowing that I won’t be interrupted if I don’t want to be, long blocks of time, and being comfortable and relaxed." Couldn't agree more – though I am of course also (?) an INTP http:// blog.samaltman.com/productivity";;@sama;;"1001835741700378625";https://twitter.com/avocade/status/1001835741700378625
;2018-05-30 01:53;0;5;"1. pronouns - she/they 2. star sign - leo ooof 3. hogwarts house - ravenclaw 4. pizza crusts - thin crust ftw?? 5. fun fact - i am an intp oof tagging: @aetstarks @infinitybrnes @wxnterbuckys @stanofloki @hiddlestonshoe @fivesosbucky https:// twitter.com/quilledegg/sta tus/1001745464973131777 …";;@aetstarks @infinitybrnes @wxnterbuckys @stanofloki @hiddlestonshoe @fivesosbucky;;"1001748373731340288";https://twitter.com/starksgardd/status/1001748373731340288
;2018-05-30 01:13;0;0;"I am having a sweet and impressive dream that an ambidextrous INTP enchantress, gently unfastening a demure yet elegant calico petticoat, breathes perplexingly 'I'll fix it later' into the ear of a chestnut Gypsy Vanner horse.";;;;"1001738306953056256";https://twitter.com/MBTIhorsewomen/status/1001738306953056256
;2018-05-29 08:03;0;0;"hmmm last time i took the test it showed that i am an istj now im an intp :/ pic.twitter.com/7fIZ8T9GUp";;;;"1001479268268847110";https://twitter.com/intoyoungk/status/1001479268268847110
;2018-05-28 23:24;0;0;"wow i am such an intp wow";;;;"1001348584636284929";https://twitter.com/emo_twt/status/1001348584636284929
;2018-05-25 12:17;0;1;"I am an INTP (a personality type) i analyse, i observe, i learn about people, how they act, how they behave, the patterns in their actions. I love humans just as much as i am curious about how they work. I swear i am NOT a psychopath.";;;;"1000093411247034370";https://twitter.com/amai__nana/status/1000093411247034370
;2018-05-25 08:05;0;1;"and yes ive never made an outline in my whole life lol who needs that i am a whole INTP";;;;"1000030177395593216";https://twitter.com/cherishfcc/status/1000030177395593216
;2018-05-25 07:29;0;0;"Reminds me of Albert Einstein. I think he was such an asshole especially with how he treated Mileva Maric and basically people around him. As an INTP , I have to be reminded of him so I don’t be an asshole. I am trying. Sorry in advance.";;;;"1000021129799467008";https://twitter.com/EiraKhanum/status/1000021129799467008
;2018-05-22 08:26;0;0;"So I thought I am an INFP for years. Now I took the test again, I am an INTP ???? Did I evolve? #personalitytest";;;#personalitytest;"998948186201903104";https://twitter.com/Paratoxical89/status/998948186201903104
;2018-05-20 18:16;0;0;"I am generally the second. But my heart is usually smiling. Between being an INTP and a Christian, my emotions are generally in check and directed toward positive directions.";;;;"998371947565256704";https://twitter.com/ACapableGenius/status/998371947565256704
;2018-05-19 21:56;0;2;"@DarthBaptist I just noticed on your profile that you are an ancap too. My son @FairicPK is INTJ and ancap too. I am an INTP . We 3 as rare as hens teeth.";;@DarthBaptist @FairicPK;;"998064935342092289";https://twitter.com/fairicbaptist/status/998064935342092289
;2018-05-19 07:28;0;1;"because I am an intp";;;;"997846446182486016";https://twitter.com/sleepyintoner/status/997846446182486016
;2018-05-15 21:30;0;0;"I used to be an ENFP, and as you can see i am now a INTP . I saw it coming.";;;;"996608871610249216";https://twitter.com/ikonhoes/status/996608871610249216
;2018-05-13 18:43;0;0;"I am having a sweet and thrilling dream that an exquisitely featured Scottish INTP baroness, gleefully unbuttoning a wisteria blue skirt, intones original incantations into the flowing mane of a beautiful brindle Canadian Pacer horse.";;;;"995841910370717700";https://twitter.com/MBTIhorsewomen/status/995841910370717700
;2018-05-13 05:24;0;3;"One of the struggles I face is trying to figure out what I am good at, and turn that into a successful career. All while coping with #ADHD and #anxiety & being an #INFP / #INTP . #SickNotWeak";;;#ADHD #anxiety #INFP #INTP #SickNotWeak;"995640955435929600";https://twitter.com/TheCunnilinguis/status/995640955435929600
;2018-05-12 23:01;0;1;"I am an intp";;;;"995544505326718977";https://twitter.com/aaphoristic/status/995544505326718977
;2018-05-11 18:08;0;2;"I thought I was an INTP but as it turns out I have remarkable fashion sense and my followers are mostly poets and artists so it is much more likely that I am an INFJ. The I and the N are carved in stone.";;;;"995108327997755392";https://twitter.com/roxixmas/status/995108327997755392
;2018-05-10 22:51;0;0;"Apparently, I am now an INTP . SUCH INTERESTING pic.twitter.com/D2JPSrygce";;;;"994817174027096064";https://twitter.com/karess/status/994817174027096064
;2018-05-10 15:55;0;0;".... I think you should just get into the fuctions instead of basic your one and only argument on an online test. The test said I was INTP , but I am an ENTP. Online tests are interesting, but those results should not be taken as a fact, just bc it is the result";;;;"994712495456751621";https://twitter.com/ENTPvillain/status/994712495456751621
;2018-05-10 12:58;0;0;"Can you tell I'm an INTP ? Cuz I am ...";;;;"994668115941253121";https://twitter.com/sophie_inBflo/status/994668115941253121
;2018-05-09 20:02;0;0;"Here I thought I am an INTP . It turns out I am not. I'm an INFP-A I've forgotten I took this personality quiz years ago and I still got the same result. INFP-A, The Mediator personality";;;;"994412220279738368";https://twitter.com/squeakywheeky/status/994412220279738368
;2018-05-08 11:27;0;0;"Someone called me an “ INTP ” I took as an insult and then I realized it was some sort of personality trait? I haven’t read up on personality traits but this one might be me? I don’t fucking know. I am certainly introverted.";;;;"993920461426774016";https://twitter.com/Chatetris/status/993920461426774016
;2018-05-08 08:11;0;0;"Q&A: "WHAT ARE YOUR THOUGHTS ON MBTI?" (repost from 2016) 1) I am an INTP , In five factor I have very high agreeableness, average dominance, some introversion, action oriented (tad impulsive), very orderly,... https://www. facebook.com/curt.doolittle /posts/10156341534377264 …";;;;"993870955851239425";https://twitter.com/curtdoolittle/status/993870955851239425
;2018-05-03 16:32;0;2;"LOL, well, my attention span is too short to delve into enneagrams, but I am an INFP, formerly an INTP . My sense of justice has exploded these past few years, giving rise to the F over the T. But my love of learning persists as does my logic system.";;;;"992185211986247680";https://twitter.com/kellynoll71/status/992185211986247680
;2018-05-02 05:27;0;0;"I am a hundred percents sure I'm an INTP . Something I think it makes me look like an INFJ (as per my own research) is I find it difficult to finish sentences and frequently juxtapose words while speaking.";;;;"991655442400006144";https://twitter.com/ahmadekoekkoek/status/991655442400006144
;2018-05-01 19:57;0;2;"Me too. I am an introvert #INTP";;;#INTP;"991512090346221573";https://twitter.com/fairicbaptist/status/991512090346221573
;2018-04-30 11:48;0;2;"But I'm just an INTP with dominant Ti, so if you do plan to give some weight to my reasoning, please do so with a grain of salt, for I am hopeless in my understanding of group/tribe values and what people want. #INTP";;;#INTP;"991026562945486848";https://twitter.com/belatedINTP/status/991026562945486848
;2018-04-30 09:16;0;1;"It's a big risk and opens me up to a lot of criticism about my intelligence, which as an INTP I am fairly unprepared to deal with, lol. #MBTI #inferiorFe #intp #introvertproblems";;;#MBTI #inferiorFe #intp #introvertproblems;"990988394967830530";https://twitter.com/personalitygeni/status/990988394967830530
;2018-04-30 08:59;0;0;"I am an INTP ...What r u..? https://www. 16personalities.com/intp-strengths -and-weaknesses …";;;;"990983957968752640";https://twitter.com/vineetverma_it/status/990983957968752640
;2018-04-28 19:22;1;0;"Just realized I had added to my biography the #ISFP /Adventurer personality type. Hell no! I am a proud #INTP / Logician! * Or at least have been for the past few years, beacuse I've also been an #INTJ / Architecht and an #INFJ / Advocate. Whatever, I just fixed it.";;;#ISFP #INTP #INTJ #INFJ;"990415937189785600";https://twitter.com/kardinalidae/status/990415937189785600
;2018-04-28 15:22;0;0;"I am an INTP . What are you? http:// 16personalities.com http:// 16personalities.com /";;;;"990355550394355712";https://twitter.com/KingJasonHull/status/990355550394355712
;2018-04-28 15:14;0;1;"Haha! I get that! My mom is an INTJ. My dad is an ESTP. I am an INTJ. My sister is also an IXTJ, but a lot more different from me. My brother is INTP . Shenanigans ensue. So many shenanigans. We're all weird. We all love a good pun.";;;;"990353564383043584";https://twitter.com/J_A_Rama_SFF/status/990353564383043584
;2018-04-27 07:36;0;0;"I have an ISFP fiancé who's mad crazy about dissecting airsoft weapons and putting them back together, whenever he speaks about it it just completely blows my mind. I am definitely not one of those INTP 's either!";;;;"989875821975343112";https://twitter.com/ellymccabe/status/989875821975343112
;2018-04-26 20:59;0;0;"I am such an #intp that i used excel to track who died and who lived in #AvengersInfinityWar";;;#intp #AvengersInfinityWar;"989715698250268688";https://twitter.com/its_me_tuesday/status/989715698250268688
;2018-04-26 04:59;0;0;"i think a small part deep inside my heart, i am an intp somehow lol https:// twitter.com/mbti4ever/stat us/989199946283921409 …";;;;"989474000202940416";https://twitter.com/syllouett/status/989474000202940416
;2018-04-25 22:18;0;4;"let me know how you ended up. I am an INTP . There are 16 different personality types. Here's the list and explanation after you take it. http://www. personalityperfect.com/16-personality -types/ …";;;;"989373200583798784";https://twitter.com/AlisonR61423986/status/989373200583798784
;2018-04-25 19:16;1;4;"But I am happily married to an INTP";;;;"989327307935535105";https://twitter.com/RUBraveEnough/status/989327307935535105
;2018-04-25 17:29;0;1;"Yep, I read that four years ago, and it's how I know that I am an INTP . That was my result!";;;;"989300402234544128";https://twitter.com/JimbauxsJournal/status/989300402234544128
;2018-04-25 04:00;0;2;"I am an INTP , and this more or less describes me. What are you? http:// thezoereport.com/living/relatio nships/myers-briggs-personality-type-needs-romantic-relationships/#slide-1 …";;;#slide;"989096850857910273";https://twitter.com/JimbauxsJournal/status/989096850857910273
;2018-04-24 11:34;0;1;"I am an INTP /INTJ...it depends on my mood but is never more than 2 points on either side...lol.";;;;"988848630760202240";https://twitter.com/TeresaGrabs/status/988848630760202240
;2018-04-21 17:03;0;0;"how do i know hes an intp is because i am mutuals with ar**s (the nice ones). i noticed he was intp because intp is not v common in any type of industry";;;;"987844268508221440";https://twitter.com/vocalistirene/status/987844268508221440
;2018-04-21 06:31;0;0;"You Know You're an INTP When... https:// youtu.be/lPfdiMnrbYE @YouTube さんから who i am";;@YouTube;;"987685193954689025";https://twitter.com/micxellx/status/987685193954689025
;2018-04-20 18:47;0;0;"Fascinating I am an intp myself :) and you guys are certainly as rare as unicorn...are you familiar with the cognitive functions?";;;;"987508117071192065";https://twitter.com/LFC5times2015/status/987508117071192065
;2018-04-18 15:16;0;0;"I am an extreme INTP . We always 'chord' think. We have artifacts and limitations from how we think, but not being able to shift our perspectives isn't among them. I'm most often, but by no means exclusively, looking at from an information flow network position.";;;;"986730203631120384";https://twitter.com/Anephezeton/status/986730203631120384
;2018-04-17 21:16;0;0;"I realized that mental health issues probably distort the result - I am an INTJ but the result came out as INTP for a few years.";;;;"986458529392398336";https://twitter.com/yullichika/status/986458529392398336
;2018-04-17 10:47;0;0;"An INTP such as myself prefers to stay out of the conversation, unless a topic comes up that I am deeply passionate about (a strong emotional state). In those cases, I’m sure to make my opinions known.";;;;"986300173541433346";https://twitter.com/personalitygeni/status/986300173541433346
;2018-04-16 12:57;0;0;"You know, it's not where I thought it was. I am not an organized human, so it could take me a very long time to find it. I do remember I was slightly more green than blue, 0 orange, almost 0 gold. I just got real curious these last few days if that was common for INTP .";;;;"985970579881639936";https://twitter.com/reactionfaye/status/985970579881639936
;2018-04-15 21:51;0;0;"hello mutuals please tell me you mbti things so i can read abt u i am an intp formerly infp because of anxiety ok lit";;;;"985742487590334464";https://twitter.com/pirisoril/status/985742487590334464
;2018-04-14 17:39;0;1;"I am your second INTP friend! INTP-A As said, sometimes I slide into INTJ, too... Of which it probably also would be an A-type.";;;;"985316558678478848";https://twitter.com/brightsuzaku/status/985316558678478848
;2018-04-14 10:37;0;0;"Your very welcome Emma :) I am simply being honest and calling it how I see it! I am an intp fellow introvert haha are you familiar with the cognitive functions? if I may ask?";;;;"985210370183909377";https://twitter.com/NiCrawler69/status/985210370183909377
;2018-04-13 13:38;0;0;"I am an INTP . Where did you get that cool "summary" of the test personality traits? Did you create it yourself?";;;;"984893680493326337";https://twitter.com/Tesla_Starman/status/984893680493326337
;2018-04-13 12:03;0;0;"I got my Myers-Briggs type results and I am either an INTP or an INTJ (the results were literally one point off).";;;;"984869755814338562";https://twitter.com/lostinana/status/984869755814338562
;2018-04-13 08:49;0;0;"As an introvert ( INTP , for the curious), I am essentially incapable of small talk. I'd much prefer a meaningful conversation--and prompts definitely help! https:// twitter.com/_BlackMuses/st atus/984820200523649024 …";;;;"984820964755148800";https://twitter.com/MiniMuseologist/status/984820964755148800
;2018-04-12 09:58;0;0;"I am an I-N-T-F-J-P, I play high speed process thinking-feeling judging perceiving Ping Pong; I am not INTJ, not INFJ, not INTP or INFP; I am an IN. I have no interest in walking a tightrope, but I stand on one on the tip of one toe";;;;"984475905748697088";https://twitter.com/Phrygi2/status/984475905748697088
;2018-04-12 07:33;0;3;""Oh yeah, I'm True Neutral, a Pisces, a Water Dog, an INTP , and now, friends, I am a Blue Illusion Deck."";;;;"984439368768245760";https://twitter.com/TheMadWelshman/status/984439368768245760
;2018-04-10 21:55;0;0;"We revel in #meme exchange. I say we, because this is my #quadra . I am an #INTj (or #INTP in #MBTI ). We love taking in information from a broad range of subjects. Narrow expertise often bores us.";;;#meme #quadra #INTj #INTP #MBTI;"983931465124732928";https://twitter.com/findmegulenko/status/983931465124732928
;2018-04-10 19:49;0;0;"i sometimes think i am an intp . but. -.-";;;;"983899757281034240";https://twitter.com/syllouett/status/983899757281034240
;2018-04-09 10:06;0;1;"as an INTP , I think I am as mathematically far as I could possible be from you both on a chart where you can measure Euclidian distances. pic.twitter.com/IpujqT4aCn";;;;"983390811113975808";https://twitter.com/YerrikTRB/status/983390811113975808
;2018-04-08 09:04;0;1;"And finally Day 10 of the Alec Had the Highest Score in Putt Putt at Mt. Atlanticus Fun Fact Punishment I am an INTP on the Meyers Briggs test. I’m a Slytherin and would be Peter Balish in Game of Thrones. My astrological sign is Libra but I had to look that up.";;;;"983012760890916865";https://twitter.com/UCSB_Ultimate/status/983012760890916865
;2018-04-03 13:07;0;0;"this is a mood... for a while i thought i was entp but alas i am just an intp with adhd, Ti rules every waking moment of my got damn life... i'm out here excusing my bullshit w/ "haha sorry guys that's just the Ti" and when people ask questions i type them, i'm in HELL";;;;"981261809431687168";https://twitter.com/bigbangstream/status/981261809431687168
;2018-03-29 14:51;0;1;"With all of this being said, yes, I have always considered myself more mature than other individuals who are within my age range. I am actually 23, not 30-39, as ApplyMagicSauce indicates. I have completed many MBTI tests before, and am typed as an INTP , but..../1";;;;"979476109371871232";https://twitter.com/JohnLennonLemon/status/979476109371871232
;2018-03-29 13:42;0;0;"Yep!!!! Some people thought i was an INFP but everytime i take the test most of the results are INTP . I had INFP as a result once but the rest of the tests i had showed that i am an INTP";;;;"979458875958030336";https://twitter.com/aquivrr/status/979458875958030336
;2018-03-28 14:40;0;2;"Found a piece of paper from 2005 that has me classified as an INTP and now I don't know who I am anymore.";;;;"979111082324213760";https://twitter.com/josswheelin/status/979111082324213760
;2018-03-27 17:36;0;2;"Well that’s good also sad. I honestly think you could be an entp. Your reasoning honestly presents like a wavy Ti. Given I am not the best at gauging functions. I went through 3 types before concluding INTP . Why were you gaslighted tho? What approach were you forced to take?";;;;"978792932886155265";https://twitter.com/Torinspeer/status/978792932886155265
;2018-03-26 03:51;0;0;"im an intp and i am in no way like seokjin lmao";;;;"978222848828309504";https://twitter.com/STlGMATAEH/status/978222848828309504
;2018-03-26 02:46;0;0;"omg i am aware that yoongi n i have a lot in common n i think thats how he ended up being my ult but i jsut remembered how hes also an intp and it . Makes so much sense";;;;"978206556067061760";https://twitter.com/kkulnamja/status/978206556067061760
;2018-03-25 19:28;0;1;"Owemgee... I am an INTP too. No wonder I love him so much. I can relate. https:// twitter.com/maegha9/status /978095208024899585 …";;;;"978096400440344576";https://twitter.com/HedgehogMeerkat/status/978096400440344576
;2018-03-25 16:42;0;1;"Sometimes I am . But I like do so for practial ends too much and there are some hairs that I think are too pointless to split philosophically . I know this because my brother is an #intp and will theorize for the sake of theorizing. Drives me nuts. XD";;;#intp;"978054436194078720";https://twitter.com/J_A_Rama_SFF/status/978054436194078720
;2018-03-25 13:54;0;0;"As an INTP I am not sure if you have any questions or concerns please visit the plug-in settings to determine how attachments are handled https:// twitter.com/INFP_Thoughts/ status/977170285731381253 …";;;;"978012207937093632";https://twitter.com/albright_sh/status/978012207937093632
;2018-03-25 07:21;0;0;"And why do they think I am an INTP ? Sector General classifies me as a DBDG.";;;;"977913248572956673";https://twitter.com/WolfBaginski/status/977913248572956673
;2018-03-24 06:22;0;0;"[1/2] Economic Research is one of the subjects where I have the most fun. Well, I am an INTP based on the Myers-Briggs typology. Various personality websites would tell you that an INTP would enjoy research-based jobs. #EconomicResearch #INTP #MyersBriggsTypology";;;#EconomicResearch #INTP #MyersBriggsTypology;"977536230333194242";https://twitter.com/MrTearyEyes/status/977536230333194242
;2018-03-23 19:24;0;3;"But sometimes I am an INTP that's what I kept scoring everytime I took the test. I should take it again pic.twitter.com/he25zX1ZGP";;;;"977370566750486529";https://twitter.com/motinvasion/status/977370566750486529
;2018-03-22 18:51;0;0;"Nope. On top of that I am (allegedly) an INTP . I can manipulate the results to get any Hayden type I want and Eros still didn't get my Perfect Match type right, because they don't have my perfect match type as an option, whatever it might be.";;;;"976999960456646657";https://twitter.com/StoryGirl83/status/976999960456646657
;2018-03-22 17:28;0;1;"since when i am an intp pic.twitter.com/xVhJsmR6mG";;;;"976978862256074752";https://twitter.com/ultjyist/status/976978862256074752
;2018-03-21 20:58;0;1;"Q. What is your MBTI type? A. I am an INTP /INFP cusp (51% T 49% F). I used to be solidly INFP but as I’ve gotten older I’ve learned to rely and act on critical thought rather than just my feelings and remain grounded in reality and dealing w facts.";;;;"976669538392723456";https://twitter.com/mermaidradfem/status/976669538392723456
;2018-03-21 18:14;0;0;"I am disappointed in u az an INTP Virgo Hahaha jek";;;;"976628130071719938";https://twitter.com/dotCLN/status/976628130071719938
;2018-03-21 17:44;0;1;"@DanaPerino I am a fellow introvert, however, I think introverts can be extroverts in a situation where it’s needed. According to the Myers-Briggs test I am an INTP . #IllTellYouWhat";;@DanaPerino;#IllTellYouWhat;"976620476394033152";https://twitter.com/BookishAthena/status/976620476394033152
;2018-03-20 00:46;0;7;"Me an #INTP me: whatever .. I am not going to be the group leader ..hate dealing with people Also me: * takes control and assigns tasks, also happens to be the spokesperson* Why am I so confusing :/ I know I can do it despite my introversion, its just I need to be forced to";;;#INTP;"976002103125692416";https://twitter.com/vague_idea5/status/976002103125692416
;2018-03-18 05:39;0;2;"I have taken it and about a thousand other personality tests. #INTP here. Knowing hasn't really changed anything for me other than I can say definitively that I am an introvert even when people think I'm an extrovert (I'm just semi-outgoing).";;;#INTP;"975351105415778305";https://twitter.com/WarptotheStars/status/975351105415778305
